Key	Pronunciation	Lexeme	Transliteration	Definition	StrongsNumber
g3089	loo'-o	λύω	lýō	"[λύω] a primary verb; to ""loosen"" (literally or figuratively) Compare {{g4486}}."	g3089
g3088	lookh'-nos	λύχνος	lýchnos	[λύχνος] from the base of {{g3022}}; a portable lamp or other illuminator (literally or figuratively)	g3088
g3087	lookh-nee'-ah	λυχνία	lychnía	[λυχνία] from {{g3088}}; a lamp-stand (literally or figuratively)	g3087
g3086	loo-tro-tace'	λυτρωτής	lytrōtḗs	[λυτρωτής] from {{g3084}}; a redeemer (figuratively)	g3086
g3085	loo'-tro-sis	λύτρωσις	lýtrōsis	[λύτρωσις] from {{g3084}}; a ransoming (figuratively)	g3085
g3084	loo-tro'-o	λυτρόω	lytróō	[λυτρόω] from {{g3083}}; to ransom (literally or figuratively)	g3084
g3083	loo'-tron	λύτρον	lýtron	[λύτρον] from {{g3089}}; something to loosen with, i.e. a redemption price (figuratively, atonement)	g3083
g3082	loos'-trah	Λύστρα	Lýstra	[Λύστρα] of uncertain origin; Lystra, a place in Asia Minor	g3082
g3081	loo-sit-el-i'	λυσιτελεῖ	lysiteleî	[λυσιτελεῖ] third person singular present indicative active of a derivative of a compound of {{g3080}} and {{g5056}}; impersonally, it answers the purpose, i.e. is advantageous	g3081
g3080	loo'-sis	λύσις	lýsis	[λύσις] from {{g3089}}; a loosening, i.e. (specially), divorce	g3080
g3007	li'-po	λείπω	leípō	[λείπω] a primary verb; to leave, i.e. (intransitively or passively) to fail or be absent	g3007
g3006	li'-os	λεῖος	leîos	"[λεῖος] apparently a primary word; smooth, i.e. ""level"""	g3006
g3005	lime'-mah	λεῖμμα	leîmma	[λεῖμμα] from {{g3007}}; a remainder	g3005
g3004	leg'-o	λέγω	légō	"[λέγω] a primary verb; properly, to ""lay"" forth, i.e. (figuratively) relate (in words (usually of systematic or set discourse; whereas {{g2036}} and {{g5346}} generally refer to an individual expression or speech respectively; while {{g4483}} is properly to break silence merely, and {{g2980}} means an extended or random harangue)); by implication, to mean"	g3004
g3003	leg-eh-ohn'	λεγεών	legeṓn	"[λεγεών] of Latin origin; a ""legion"", i.e. Roman regiment (figuratively)"	g3003
g3002	leb-bah'-yos	Λεββαῖος	Lebbaîos	[Λεββαῖος] of uncertain origin; Lebbæus, a Christian	g3002
g3001	lakh'-an-on	λάχανον	láchanon	[λάχανον] from λαχαίνω (to dig); a vegetable	g3001
g3009	li-toorg-ee'-ah	λειτουργία	leitourgía	"[λειτουργία] from {{g3008}}; public function (as priest (""liturgy"") or almsgiver)"	g3009
g3008	li-toorg-eh'-o	λειτουργέω	leitourgéō	[λειτουργέω] from {{g3011}}; to be a public servant, i.e. (by analogy) to perform religious or charitable functions (worship, obey, relieve)	g3008
g3065	loo-kas'	Λουκᾶς	Loukâs	[Λουκᾶς] contracted from Latin ; Lucas, a Christian	g3065
g3064	loy-poo'	λοιποῦ	loipoû	[λοιποῦ] genitive case singular of the same as {{g3062}}; remaining time	g3064
g3067	loo-tron'	λουτρόν	loutrón	[λουτρόν] from {{g3068}}; a bath, i.e. (figuratively), baptism	g3067
g3066	loo'-kee-os	Λούκιος	Loúkios	[Λούκιος] of Latin origin; illuminative; Lucius, a Christian	g3066
g3061	loy'-mos	λοιμός	loimós	[λοιμός] of uncertain affinity; a plague (literally, the disease, or figuratively, a pest)	g3061
g3060	loy'-dor-os	λοίδορος	loídoros	[λοίδορος] from λοιδός (mischief); abusive, i.e. a blackguard	g3060
g3063	loy-pon'	λοιπόν	loipón	[λοιπόν] neuter singular of the same as {{g3062}}; something remaining (adverbially)	g3063
g3062	loy-poy'	λοιποί	loipoí	[λοιποί] masculine plural of a derivative of {{g3007}}; remaining ones	g3062
g3069	lud'-dah	Λύδδα	Lýdda	[Λύδδα] of Hebrew origin ({{h3850}}); Lydda (i.e. Lod), a place in Palestine	g3069
g3068	loo'-o	λούω	loúō	[λούω] a primary verb; to bathe (the whole person; whereas {{g3538}} means to wet a part only, and {{g4150}} to wash, cleanse garments exclusively)	g3068
g3098	mag-ogue'	Μαγώγ	Magṓg	[Μαγώγ] of Hebrew origin ({{h4031}}); Magog, a foreign nation, i.e. (figuratively) an Antichristian party	g3098
g3099	mad-ee-on'	Μαδιάν	Madián	[Μαδιάν] of Hebrew origin ({{h4080}}); Madian (i.e. Midian), a region of Arabia	g3099
g3090	lo-ece'	Λωΐς	Lōḯs	[Λωΐς] of uncertain origin; Lois, a Christian woman	g3090
g3091	lote	Λώτ	Lṓt	[Λώτ] of Hebrew origin ({{h3876}}); Lot, a patriarch	g3091
g3092	mah-ath'	Μαάθ	Maáth	[Μαάθ] probably of Hebrew origin; Maath, an Israelite	g3092
g3093	mag-dal-ah'	Μαγδαλά	Magdalá	[Μαγδαλά] of Chaldee origin (compare {{h4026}}); the tower; Magdala (i.e. Migdala), a place in Palestine	g3093
g3094	mag-dal-ay-nay'	Μαγδαληνή	Magdalēnḗ	[Μαγδαληνή] feminine of a derivative of {{g3093}}; a female Magdalene, i.e. inhabitant of Magdala	g3094
g3095	mag-i'-ah	μαγεία	mageía	"[μαγεία] from {{g3096}}; ""magic"""	g3095
g3096	mag-yoo'-o	μαγεύω	mageúō	[μαγεύω] from {{g3097}}; to practice magic	g3096
g3097	mag'-os	μάγος	mágos	[μάγος] of foreign origin ({{h7248}}); a Magian, i.e. Oriental scientist; by implication, a magician	g3097
g3010	li-toorg-ik-os'	λειτουργικός	leitourgikós	"[λειτουργικός] from the same as {{g3008}}; functional publicly (""liturgic""); i.e. beneficient"	g3010
g3011	li-toorg-os'	λειτουργός	leitourgós	[λειτουργός] from a derivative of {{g2992}} and {{g2041}}; a public servant, i.e. a functionary in the Temple or Gospel, or (genitive case) a worshipper (of God) or benefactor (of man)	g3011
g3012	len'-tee-on	λέντιον	léntion	"[λέντιον] of Latin origin; a ""linen"" cloth, i.e. apron"	g3012
g3013	lep-is'	λεπίς	lepís	[λεπίς] from λέπω (to peel); a flake	g3013
g3014	lep'-rah	λέπρα	lépra	"[λέπρα] from the same as {{g3013}}; scaliness, i.e. ""leprosy"""	g3014
g3015	lep-ros'	λεπρός	leprós	[λεπρός] from the same as {{g3014}}; scaly, i.e. leprous (a leper)	g3015
g3016	lep-ton'	λεπτόν	leptón	[λεπτόν] neuter of a derivative of the same as {{g3013}}; something scaled (light), i.e. a small coin	g3016
g3017	lyoo'-ee	Λευΐ	Leuḯ	[Λευΐ] of Hebrew origin ({{h3878}}); Levi, the name of three Israelites Compare {{g3018}}.	g3017
g3018	lyoo-is'	Λευΐς	Leuḯs	[Λευΐς] a form of {{g3017}}; Lewis (i.e. Levi), a Christian	g3018
g3019	lyoo-ee'-tace	Λευΐτης	Leuḯtēs	[Λευΐτης] from {{g3017}}; a Levite, i.e. descendant of Levi	g3019
g3076	loo-peh'-o	λυπέω	lypéō	[λυπέω] from {{g3077}}; to distress; reflexively or passively, to be sad	g3076
g3077	loo'-pay	λύπη	lýpē	[λύπη] apparently a primary word; sadness	g3077
g3074	loo'-kos	λύκος	lýkos	[λύκος] perhaps akin to the base of {{g3022}} (from the whitish hair); a wolf	g3074
g3075	loo-mah'-ee-nom-ahee	λυμαίνομαι	lymaínomai	[λυμαίνομαι] middle voice from a probably derivative of {{g3089}} (meaning filth); properly, to soil, i.e. (figuratively) insult (maltreat)	g3075
g3072	loo-kah-on-is-tee'	Λυκαονιστί	Lykaonistí	[Λυκαονιστί] adverb from a derivative of {{g3071}}; Lycaonistically, i.e. in the language of the Lycaonians	g3072
g3073	loo-kee'-ah	Λυκία	Lykía	[Λυκία] probably remotely from {{g3074}}; Lycia, a province of Asia Minor	g3073
g3070	loo-dee'-ah	Λυδία	Lydía	[Λυδία] properly, feminine of Ludios (of foreign origin) (a Lydian, in Asia Minor); Lydia, a Christian woman	g3070
g3071	loo-kah-on-ee'-ah	Λυκαονία	Lykaonía	[Λυκαονία] perhaps remotely from {{g3074}}; Lycaonia, a region of Asia Minor	g3071
g3078	loo-san-ee'-as	Λυσανίας	Lysanías	[Λυσανίας] from {{g3080}} and ἀνία (trouble); grief-dispelling; Lysanias, a governor of Abilene	g3078
g3079	loo-see'-as	Λυσίας	Lysías	[Λυσίας] of uncertain affinity; Lysias, a Roman	g3079
g3043	lee'-non	λίνον	línon	"[λίνον] probably a primary word; flax, i.e. (by implication) ""linen"""	g3043
g3042	lee-mos'	λιμός	limós	[λιμός] probably from {{g3007}} (through the idea of destitution); a scarcity of food	g3042
g3041	lim'-nay	λίμνη	límnē	[λίμνη] probably from {{g3040}} (through the idea of nearness of shore); a pond (large or small)	g3041
g3040	lee-mane'	λιμήν	limḗn	[λιμήν] apparently a primary word; a harbor Compare {{g2568}}.	g3040
g3047	leeps	λίψ	líps	"[λίψ] probably from λείβω (to pour a ""libation""); the south(- west) wind (as bringing rain, i.e. (by extension) the south quarter)"	g3047
g3046	lee'-trah	λίτρα	lítra	[λίτρα] of Latin origin (libra); a pound in weight	g3046
g3045	lip-ar-os'	λιπαρός	liparós	[λιπαρός] from λίπος (grease); fat, i.e. (figuratively) sumptuous	g3045
g3044	lee'-nos	Λίνος	Línos	[Λίνος] perhaps from {{g3043}}; Linus, a Christian	g3044
g3049	log-id'-zom-ahee	λογίζομαι	logízomai	[λογίζομαι] middle voice from {{g3056}}; to take an inventory, i.e. estimate (literally or figuratively)	g3049
g3048	log-ee'-ah	λογία	logía	[λογία] from {{g3056}} (in the commercial sense); a contribution	g3048
g3058	loy-dor-eh'-o	λοιδορέω	loidoréō	[λοιδορέω] from {{g3060}}; to reproach, i.e. vilify	g3058
g3059	loy-dor-ee'-ah	λοιδορία	loidoría	[λοιδορία] from {{g3060}}; slander or vituperation	g3059
g3054	log-om-akh-eh'-o	λογομαχέω	logomachéō	[λογομαχέω] from a compound of {{g3056}} and {{g3164}}; to be disputatious (on trifles)	g3054
g3055	log-om-akh-ee'-ah	λογομαχία	logomachía	"[λογομαχία] from the same as {{g3054}}; disputation about trifles (""logomachy"")"	g3055
g3056	log'-os	λόγος	lógos	[λόγος] from {{g3004}}; something said (including the thought); by implication, a topic (subject of discourse), also reasoning (the mental faculty) or motive; by extension, a computation; specially, (with the article in John) the Divine Expression (i.e. Christ)	g3056
g3057	long'-khay	λόγχη	lónchē	"[λόγχη] perhaps a primary word; a ""lance"""	g3057
g3050	log-ik-os'	λογικός	logikós	"[λογικός] from {{g3056}}; rational (""logical"")"	g3050
g3051	log'-ee-on	λόγιον	lógion	[λόγιον] neuter of {{g3052}}; an utterance (of God)	g3051
g3052	log'-ee-os	λόγιος	lógios	[λόγιος] from {{g3056}}; fluent, i.e. an orator	g3052
g3053	log-is-mos'	λογισμός	logismós	[λογισμός] from {{g3049}}; computation, i.e. (figuratively) reasoning (conscience, conceit)	g3053
g3029	lee'-an	λίαν	lían	[λίαν] of uncertain affinity; much (adverbially)	g3029
g3028	lape'-sis	λῆμψις	lēmpsis	[λῆμψις] from {{g2983}}; receipt (the act)	g3028
g3021	lyoo-kah'-ee-no	λευκαίνω	leukaínō	[λευκαίνω] from {{g3022}}; to whiten	g3021
g3020	lyoo-it'-ee-kos	Λευϊτικός	Leuïtikós	[Λευϊτικός] from {{g3019}}; Levitic, i.e. relating to the Levites	g3020
g3023	leh-ohn'	λέων	léōn	"[λέων] a primary word; a ""lion"""	g3023
g3022	lyoo-kos'	λευκός	leukós	"[λευκός] from λύκη (""light""); white"	g3022
g3025	lay-nos'	ληνός	lēnós	[ληνός] apparently a primary word; a trough, i.e. wine-vat	g3025
g3024	lay'-thay	λήθη	lḗthē	[λήθη] from {{g2990}}; forgetfulness	g3024
g3027	lace-tace'	λῃστής	lēistḗs	[λῃστής] from ληΐζομαι (to plunder); a brigand	g3027
g3026	lay'-ros	λῆρος	lēros	[λῆρος] apparently a primary word; twaddle, i.e. an incredible story	g3026
g3038	lith-os'-tro-tos	λιθόστρωτος	lithóstrōtos	[λιθόστρωτος] from {{g3037}} and a derivative of {{g4766}}; stone-strewed, i.e. a tessellated mosaic on which the Roman tribunal was placed	g3038
g3039	lik-mah'-o	λικμάω	likmáō	[λικμάω] from λικμός, the equivalent of λίκνον (a winnowing fan or basket); to winnow, i.e. (by analogy), to triturate	g3039
g3032	lib-er-tee'-nos	Λιβερτῖνος	Libertînos	[Λιβερτῖνος] of Latin origin; a Roman freedman	g3032
g3033	lib-oo'-ay	Λιβύη	Libýē	[Λιβύη] probably from {{g3047}}; Libye, a region of Africa	g3033
g3030	lib'-an-os	λίβανος	líbanos	[λίβανος] of foreign origin ({{h3828}}); the incense-tree, i.e. (by implication) incense itself	g3030
g3031	lib-an-o-tos'	λιβανωτός	libanōtós	[λιβανωτός] from {{g3030}}; frankincense, i.e. (by extension) a censer for burning it	g3031
g3036	lith-ob-ol-eh'-o	λιθοβολέω	lithoboléō	[λιθοβολέω] from a compound of {{g3037}} and {{g906}}; to throw stones, i.e. lapidate	g3036
g3037	lee'-thos	λίθος	líthos	[λίθος] apparently a primary word; a stone (literally or figuratively)	g3037
g3034	lith-ad'-zo	λιθάζω	litházō	[λιθάζω] from {{g3037}}; to lapidate	g3034
g3035	lith-ee'-nos	λίθινος	líthinos	[λίθινος] from {{g3037}}; stony, i.e. made of stone	g3035
g3100	math-ayt-yoo'-o	μαθητεύω	mathēteúō	[μαθητεύω] from {{g3101}}; intransitively, to become a pupil; transitively, to disciple, i.e. enrol as scholar	g3100
