Key	Pronunciation	Lexeme	Transliteration	Definition	StrongsNumber
g5351	fthi'-ro	φθείρω	phtheírō	[φθείρω] probably strengthened from φθίω (to pine or waste); properly, to shrivel or wither, i.e. to spoil (by any process) or (generally) to ruin (especially figuratively, by moral influences, to deprave)	g5351
g5350	ftheng'-gom-ahee	φθέγγομαι	phthéngomai	[φθέγγομαι] probably akin to {{g5338}} and thus to {{g5346}}; to utter a clear sound, i.e. (generally) to proclaim	g5350
g5353	ftong'-gos	φθόγγος	phthóngos	[φθόγγος] from {{g5350}}; utterance, i.e. a musical note (vocal or instrumental)	g5353
g5352	fthin-op-o-ree-nos'	φθινοπωρινός	phthinopōrinós	[φθινοπωρινός] from derivative of φθίνω  (to wane; akin to the base of {{g5351}}) and {{g3703}} (meaning late autumn); autumnal (as stripped of leaves)	g5352
g5355	fthon'-os	φθόνος	phthónos	[φθόνος] probably akin to the base of {{g5351}}; ill-will (as detraction), i.e. jealousy (spite)	g5355
g5354	fthon-eh'-o	φθονέω	phthonéō	[φθονέω] from {{g5355}}; to be jealous of	g5354
g5357	fee-al'-ay	φιάλη	phiálē	"[φιάλη] of uncertain affinity; a broad shallow cup (""phial"")"	g5357
g5356	fthor-ah'	φθορά	phthorá	[φθορά] from {{g5351}}; decay, i.e. ruin (spontaneous or inflicted, literally or figuratively)	g5356
g5359	fil-ad-el'-fee-ah	Φιλαδέλφεια	Philadélpheia	[Φιλαδέλφεια] from Φιλάδελφος (the same as {{g5361}}), a king of Pergamos; Philadelphia, a place in Asia Minor	g5359
g5358	fil-ag'-ath-os	φιλάγαθος	philágathos	[φιλάγαθος] from {{g5384}} and {{g18}}; fond to good, i.e. a promoter of virtue	g5358
g5342	fer'-o	φέρω	phérō	"[φέρω] a primary verb (for which other, and apparently not cognate ones are used in certain tenses only; namely,          οἴω;       and ἐνέγκω; to ""bear"" or carry (in a very wide application, literally and figuratively, as follows)"	g5342
g5343	fyoo'-go	φεύγω	pheúgō	[φεύγω] apparently a primary verb; to run away (literally or figuratively); by implication, to shun; by analogy, to vanish	g5343
g5340	fi-dom-en'-oce	φειδομένως	pheidoménōs	[φειδομένως] adverb from participle of {{g5339}}; abstemiously, i.e. stingily	g5340
g5341	fel-on'-ace	φελόνης	phelónēs	[φελόνης] by transposition for a derivative probably of {{g5316}} (as showing outside the other garments); a mantle (surtout)	g5341
g5346	fay-mee'	φημί	phēmí	[φημί] properly, the same as the base of {{g5457}} and {{g5316}}; to show or make known one's thoughts, i.e. speak or say Compare {{g3004}}.	g5346
g5347	face'-tos	Φῆστος	Phēstos	[Φῆστος] of Latin derivation; festal; Phestus (i.e. Festus), a Roman	g5347
g5344	fay'-lix	Φῆλιξ	Phēlix	[Φῆλιξ] of Latin origin; happy; Phelix (i.e. Felix), a Roman	g5344
g5345	fay'-may	φήμη	phḗmē	"[φήμη] from {{g5346}}; a saying, i.e. rumor (""fame"")"	g5345
g5348	fthan'-o	φθάνω	phthánō	[φθάνω] apparently a primary verb; to be beforehand, i.e. anticipate or precede; by extension, to have arrived at	g5348
g5349	fthar-tos'	φθαρτός	phthartós	[φθαρτός] from {{g5351}}; decayed, i.e. (by implication) perishable	g5349
g5379	fil-on-i-kee'-ah	φιλονεικία	philoneikía	[φιλονεικία] from {{g5380}}; quarrelsomeness, i.e. a dispute	g5379
g5378	fil-ol'-og-os	Φιλόλογος	Philólogos	"[Φιλόλογος] from {{g5384}} and {{g3056}}; fond of words, i.e. talkative (argumentative, learned, ""philological""); Philologus, a Christian"	g5378
g5377	fil-oth'-eh-os	φιλόθεος	philótheos	[φιλόθεος] from {{g5384}} and {{g2316}}; fond of God, i.e. pious	g5377
g5376	fil'-ip-pos	Φίλιππος	Phílippos	[Φίλιππος] from {{g5384}} and {{g2462}}; fond of horses; Philippus, the name of four Israelites	g5376
g5375	fil'-ip-poy	Φίλιπποι	Phílippoi	[Φίλιπποι] plural of {{g5376}}; Philippi, a place in Macedonia	g5375
g5374	fil-ip-pay'-see-os	Φιλιππήσιος	Philippḗsios	[Φιλιππήσιος] from {{g5375}}; a Philippesian (Philippian), i.e. native of Philippi	g5374
g5373	fil-ee'-ah	φιλία	philía	[φιλία] from {{g5384}}; fondness	g5373
g5372	fil-ay-tos'	Φίλητος	Phílētos	[Φίλητος] from {{g5368}}; amiable; Philetus, an opposer of Christianity	g5372
g5371	fil-ay'-mone	Φιλήμων	Philḗmōn	[Φιλήμων] from {{g5368}}; friendly; Philemon, a Christian	g5371
g5370	fil'-ay-mah	φίλημα	phílēma	[φίλημα] from {{g5368}}; a kiss	g5370
g5319	fan-er-o'-o	φανερόω	phaneróō	[φανερόω] from {{g5318}}; to render apparent (literally or figuratively)	g5319
g5318	fan-er-os'	φανερός	phanerós	[φανερός] from {{g5316}}; shining, i.e. apparent (literally or figuratively); neuter (as adverb) publicly, externally	g5318
g5315	fag'-o	φάγω	phágō	[φάγω] a primary verb (used as an alternate of {{g2068}} in certain tenses); to eat (literally or figuratively)	g5315
g5314	fag'-os	φάγος	phágos	[φάγος] from {{g5315}}; a glutton	g5314
g5317	fal'-ek	Φάλεκ	Phálek	[Φάλεκ] of Hebrew origin ({{h6389}}); Phalek (i.e. Peleg), a patriarch	g5317
g5316	fah'-ee-no	φαίνω	phaínō	[φαίνω] prolongation for the base of {{g5457}}; to lighten (shine), i.e. show (transitive or intransitive, literal or figurative)	g5316
g5311	hoop'-sos	ὕψος	hýpsos	[ὕψος] from a derivative of {{g5228}}; elevation, i.e. (abstractly) altitude, (specially), the sky, or (figuratively) dignity	g5311
g5310	hoop'-sis-tos	ὕψιστος	hýpsistos	[ὕψιστος] superlative from the base of {{g5311}}; highest, i.e. (masculine singular) the Supreme (God), or (neuter plural) the heavens	g5310
g5313	hoop'-so-mah	ὕψωμα	hýpsōma	[ὕψωμα] from {{g5312}}; an elevated place or thing, i.e. (abstractly) altitude, or (by implication) a barrier (figuratively)	g5313
g5312	hoop-so'-o	ὑψόω	hypsóō	[ὑψόω] from {{g5311}}; to elevate (literally or figuratively)	g5312
g5395	flox	φλόξ	phlóx	"[φλόξ] from a primary φλέγω (to ""flash"" or ""flame""); a blaze"	g5395
g5394	flog-id'-zo	φλογίζω	phlogízō	[φλογίζω] from {{g5395}}; to cause a blaze, i.e. ignite (figuratively, to inflame with passion)	g5394
g5397	floo'-ar-os	φλύαρος	phlýaros	[φλύαρος] from φλύω (to bubble); a garrulous person, i.e. prater	g5397
g5396	floo-ar-eh'-o	φλυαρέω	phlyaréō	[φλυαρέω] from {{g5397}}; to be a babbler or trifler, i.e. (by implication) to berate idly or mischievously	g5396
g5391	fil-of'-rone	φιλόφρων	philóphrōn	[φιλόφρων] from {{g5384}} and {{g5424}}; friendly of mind, i.e. kind	g5391
g5390	fil-of-ron'-oce	φιλοφρόνως	philophrónōs	[φιλοφρόνως] adverb from {{g5391}}; with friendliness of mind, i.e. kindly	g5390
g5393	fleg'-one	Φλέγων	Phlégōn	[Φλέγων] active participle of the base of {{g5395}}; blazing; Phlegon, a Christian	g5393
g5392	fee-mo'-o	φιμόω	phimóō	[φιμόω] from φιμός (a muzzle); to muzzle	g5392
g5399	fob-eh'-o	φοβέω	phobéō	[φοβέω] from {{g5401}}; to frighten, i.e. (passively) to be alarmed; by analogy, to be in awe of, i.e. revere	g5399
g5398	fob-er-os'	φοβερός	phoberós	[φοβερός] from {{g5401}}; frightful, i.e. (objectively) formidable	g5398
g5368	fil-eh'-o	φιλέω	philéō	[φιλέω] from {{g5384}}; to be a friend to (fond of (an individual or an object)), i.e. have affection for (denoting personal attachment, as a matter of sentiment or feeling; while {{g25}} is wider, embracing especially the judgment and the deliberate assent of the will as a matter of principle, duty and propriety: the two thus stand related very much as {{g2309}} and {{g1014}}, or as {{g2372}} and {{g3563}} respectively; the former being chiefly of the heart and the latter of the head); specially, to kiss (as a mark of tenderness)	g5368
g5369	fil-ay'-don-os	φιλήδονος	philḗdonos	[φιλήδονος] from {{g5384}} and {{g2237}}; fond of pleasure, i.e. voluptuous	g5369
g5360	fil-ad-el-fee'-ah	φιλαδελφία	philadelphía	[φιλαδελφία] from {{g5361}}; fraternal affection	g5360
g5361	fil-ad'-el-fos	φιλάδελφος	philádelphos	[φιλάδελφος] from {{g5384}} and {{g80}}; fond of brethren, i.e. fraternal	g5361
g5362	fil'-an-dros	φίλανδρος	phílandros	[φίλανδρος] from {{g5384}} and {{g435}}; fond of man, i.e. affectionate as a wife	g5362
g5363	fil-an-thro-pee'-ah	φιλανθρωπία	philanthrōpía	"[φιλανθρωπία] from the same as {{g5364}}; fondness of mankind, i.e. benevolence (""philanthropy"")"	g5363
g5364	fil-an-thro'-poce	φιλανθρώπως	philanthrṓpōs	"[φιλανθρώπως] adverb from a compound of {{g5384}} and {{g444}}; fondly to man (""philanthropically""), i.e. humanely"	g5364
g5365	fil-ar-goo-ree'-ah	φιλαργυρία	philargyría	[φιλαργυρία] from {{g5366}}; avarice	g5365
g5366	fil-ar'-goo-ros	φιλάργυρος	philárgyros	[φιλάργυρος] from {{g5384}} and {{g696}}; fond of silver (money), i.e. avaricious	g5366
g5367	fil'-ow-tos	φίλαυτος	phílautos	[φίλαυτος] from {{g5384}} and {{g846}}; fond of self, i.e. selfish	g5367
g5308	hoop-say-los'	ὑψηλός	hypsēlós	[ὑψηλός] from {{g5311}}; lofty (in place or character)	g5308
g5309	hoop-say-lo-fron-eh'-o	ὑψηλοφρονέω	hypsēlophronéō	[ὑψηλοφρονέω] from a compound of {{g5308}} and {{g5424}}; to be lofty in mind, i.e. arrogant	g5309
g5306	hoos'-ter-os	ὕστερος	hýsteros	[ὕστερος] comparative from {{g5259}} (in the sense of behind); later	g5306
g5307	hoo-fan-tos'	ὑφαντός	hyphantós	[ὑφαντός] from ὑφαίνω to weave; woven, i.e. (perhaps) knitted	g5307
g5304	hoos-ter'-ay-sis	ὑστέρησις	hystérēsis	[ὑστέρησις] from {{g5302}}; a falling short, i.e. (specially), penury	g5304
g5305	hoos'-ter-on	ὕστερον	hýsteron	[ὕστερον] neuter of {{g5306}} as adverb; more lately, i.e. eventually	g5305
g5302	hoos-ter-eh'-o	ὑστερέω	hysteréō	[ὑστερέω] from {{g5306}}; to be later, i.e. (by implication) to be inferior; generally, to fall short (be deficient)	g5302
g5303	hoos-ter'-ay-mah	ὑστέρημα	hystérēma	[ὑστέρημα] from {{g5302}}; a deficit; specially, poverty	g5303
g5301	hoos'-so-pos	ὕσσωπος	hýssōpos	"[ὕσσωπος] of foreign origin ({{h231}}); ""hyssop"""	g5301
g5386	fil-os'-of-os	φιλόσοφος	philósophos	"[φιλόσοφος] from {{g5384}} and {{g4680}}; fond of wise things, i.e. a ""philosopher"""	g5386
g5387	fil-os'-tor-gos	φιλόστοργος	philóstorgos	[φιλόστοργος] from {{g5384}} and στοργή (cherishing one's kindred, especially parents or children); fond of natural relatives, i.e. fraternal towards fellow Christian	g5387
g5384	fee'-los	φίλος	phílos	[φίλος] properly, dear, i.e. a friend; actively, fond, i.e. friendly (still as a noun, an associate, neighbor, etc.)	g5384
g5385	fil-os-of-ee'-ah	φιλοσοφία	philosophía	"[φιλοσοφία] from {{g5386}}; ""philosophy"", i.e. (specially), Jewish sophistry"	g5385
g5382	fil-ox'-en-os	φιλόξενος	philóxenos	[φιλόξενος] from {{g5384}} and {{g3581}}; fond of guests, i.e. hospitable	g5382
g5383	fil-op-rote-yoo'-o	φιλοπρωτεύω	philoprōteúō	[φιλοπρωτεύω] from a compound of {{g5384}} and {{g4413}}; to be fond of being first, i.e. ambitious of distinction	g5383
g5380	fil-on'-i-kos	φιλόνεικος	philóneikos	[φιλόνεικος] from {{g5384}} and νεῖκος (a quarrel; probably akin to {{g3534}}); fond of strife, i.e. disputatious	g5380
g5381	fil-on-ex-ee'-ah	φιλονεξία	philonexía	[φιλονεξία] from {{g5382}}; hospitableness	g5381
g5388	fil-ot'-ek-nos	φιλότεκνος	philóteknos	[φιλότεκνος] from {{g5384}} and {{g5043}}; fond of one's children, i.e. maternal	g5388
g5389	fil-ot-im-eh'-om-ahee	φιλοτιμέομαι	philotiméomai	[φιλοτιμέομαι] middle voice from a compound of {{g5384}} and {{g5092}}; to be fond of honor, i.e. emulous (eager or earnest to do something)	g5389
g5339	fi'-dom-ahee	φείδομαι	pheídomai	[φείδομαι] of uncertain affinity; to be chary of, i.e. (subjectively) to abstain or (objectively) to treat leniently	g5339
g5338	feng'-gos	φέγγος	phéngos	[φέγγος] probably akin to the base of {{g5457}} (compare {{g5350}}); brilliancy	g5338
g5333	far-mak-os'	φάρμακος	phármakos	[φάρμακος] the same as 5332	g5333
g5332	far-mak-yoos'	φαρμακεύς	pharmakeús	"[φαρμακεύς] from φάρμακον (a drug, i.e. spell-giving potion); a druggist (""pharmacist"") or poisoner, i.e. (by extension) a magician"	g5332
g5331	far-mak-i'-ah	φαρμακεία	pharmakeía	"[φαρμακεία] from {{g5332}}; medication (""pharmacy""), i.e. (by extension) magic (literally or figuratively)"	g5331
g5330	far-is-ah'-yos	Φαρισαῖος	Pharisaîos	[Φαρισαῖος] of Hebrew origin (compare {{h6567}}); a separatist, i.e. exclusively religious; a Pharisean, i.e. Jewish sectary	g5330
g5337	fow'-los	φαῦλος	phaûlos	"[φαῦλος] apparently a primary word; ""foul"" or ""flawy"", i.e. (figuratively) wicked"	g5337
g5336	fat'-nay	φάτνη	phátnē	[φάτνη] from πατέομαι (to eat); a crib (for fodder)	g5336
g5335	fas'-ko	φάσκω	pháskō	[φάσκω] prolongation from the same as {{g5346}}; to assert	g5335
g5334	fas'-is	φάσις	phásis	"[φάσις] from {{g5346}} (not the same as ""phase"", which is from {{g5316}}); a saying, i.e. report"	g5334
g5400	fob'-ay-tron	φόβητρον	phóbētron	[φόβητρον] neuter of a derivative of {{g5399}}; a frightening thing, i.e. terrific portent	g5400
g5324	fan-tad'-zo	φαντάζω	phantázō	[φαντάζω] from a derivative of {{g5316}}; to make apparent, i.e. (passively) to appear (neuter participle as noun, a spectacle)	g5324
g5325	fan-tas-ee'-ah	φαντασία	phantasía	"[φαντασία] from a derivative of {{g5324}}; (properly abstract) a (vain) show (""fantasy"")"	g5325
g5326	fan'-tas-mah	φάντασμα	phántasma	"[φάντασμα] from {{g5324}}; (properly concrete) a (mere) show (""phantasm""), i.e. spectre"	g5326
g5327	far'-anx	φάραγξ	pháranx	[φάραγξ] properly, strengthened from the base of {{g4008}} or rather of {{g4486}}; a gap or chasm, i.e. ravine (winter-torrent)	g5327
g5320	fan-er-oce'	φανερῶς	phanerōs	[φανερῶς] adverb from {{g5318}}; plainly, i.e. clearly or publicly	g5320
g5321	fan-er'-o-sis	φανέρωσις	phanérōsis	[φανέρωσις] from {{g5319}}; exhibition, i.e. (figuratively) expression, (by extension) a bestowment	g5321
g5322	fan-os'	φανός	phanós	[φανός] from {{g5316}}; a lightener, i.e. light; lantern	g5322
g5323	fan-oo-ale'	Φανουήλ	Phanouḗl	[Φανουήλ] of Hebrew origin ({{h6439}}); Phanuel (i.e. Penuel), an Israelite	g5323
g5328	far-ah-o'	Φαραώ	Pharaṓ	[Φαραώ] of foreign origin ({{h6547}}); Pharao (i.e. Pharoh), an Egyptian king	g5328
g5329	far-es'	Φάρες	Pháres	[Φάρες] of Hebrew origin ({{h6557}}); Phares (i.e. Perets), an Israelite	g5329
