Key	Pronunciation	Lexeme	Transliteration	Definition	StrongsNumber
g799	as-oong'-kree-tos	Ἀσύγκριτος	Asýnkritos	[Ἀσύγκριτος] from {{g1}} (as a negative particle) and a derivative of {{g4793}}; incomparable; Asyncritus, a Christian	g799
g798	as'-tron	ἄστρον	ástron	[ἄστρον] neuter from {{g792}}; properly, a constellation; put for a single star (natural or artificial)	g798
g791	as-ti'-os	ἀστεῖος	asteîos	[ἀστεῖος] from ἄστυ (a city); urbane, i.e. (by implication) handsome	g791
g790	as-tat-eh'-o	ἀστατέω	astatéō	[ἀστατέω] from {{g1}} (as a negative particle) and a derivative of {{g2476}}; to be non-stationary, i.e. (figuratively) homeless	g790
g793	as-tay'-rik-tos	ἀστήρικτος	astḗriktos	[ἀστήρικτος] from {{g1}} (as a negative particle) and a presumed derivative of {{g4741}}; unfixed, i.e. (figuratively) vacillating	g793
g792	as-tare'	ἀστήρ	astḗr	[ἀστήρ] probably from the base of {{g4766}}; a star (as strown over the sky), literally or figuratively	g792
g795	as-tokh-eh'-o	ἀστοχέω	astochéō	[ἀστοχέω] from a compound of {{g1}} (as a negative particle) and στοίχος (an aim); to miss the mark, i.e. (figuratively) deviate from truth	g795
g794	as'-tor-gos	ἄστοργος	ástorgos	[ἄστοργος] from {{g1}} (as a negative particle) and a presumed derivative of στέργω (to cherish affectionately); hard-hearted towards kindred	g794
g797	as-trap'-to	ἀστράπτω	astráptō	[ἀστράπτω] probably from  {{g792}}; to flash as lightning	g797
g796	as-trap-ay'	ἀστραπή	astrapḗ	[ἀστραπή] from {{g797}}; lightning; by analogy, glare	g796
g711	ar-is-tob'-oo-los	Ἀριστόβουλος	Aristóboulos	[Ἀριστόβουλος] from the same as {{g712}} and {{g1012}}; best counselling; Aristoboulus, a Christian	g711
g710	ar-is-ter-os'	ἀριστερός	aristerós	[ἀριστερός] apparently a comparative of the same as {{g712}}; the left hand (as second-best)	g710
g713	ar-ket-os'	ἀρκετός	arketós	[ἀρκετός] from {{g714}}; satisfactory	g713
g712	ar'-is-ton	ἄριστον	áriston	"[ἄριστον] apparently neuter of a superlative from the same as {{g730}}; the best meal (or breakfast; perhaps from ἦρι (""early"")), i.e. luncheon"	g712
g715	ark'-tos	ἄρκτος	árktos	[ἄρκτος] probably from {{g714}}; a bear (as obstructing by ferocity)	g715
g714	ar-keh'-o	ἀρκέω	arkéō	[ἀρκέω] apparently a primary verb (but probably akin to {{g142}} through the idea of raising a barrier); properly, to ward off, i.e. (by implication) to avail (figuratively, be satisfactory)	g714
g717	ar-mag-ed-dohn'	Ἀρμαγεδδών	Armageddṓn	[Ἀρμαγεδδών] of Hebrew origin ({{h2022}} and {{h4023}}); Armageddon (or Har-Meggiddon), a symbolic name	g717
g716	har'-mah	ἅρμα	hárma	[ἅρμα] probably from {{g142}} (perhaps with {{g1}} (as a particle of union) prefixed); a chariot (as raised or fitted together (compare {{g719}}))	g716
g719	har-mos'	ἁρμός	harmós	[ἁρμός] from the same as {{g716}}; an articulation (of the body)	g719
g718	har-mod'-zo	ἁρμόζω	harmózō	[ἁρμόζω] from {{g719}}; to joint, i.e. (figuratively) to woo (reflexively, to betroth)	g718
g800	as-oom'-fo-nos	ἀσύμφωνος	asýmphōnos	[ἀσύμφωνος] from {{g1}} (as a negative particle) and {{g4859}}; inharmonious (figuratively)	g800
g764	as-eb-eh'-o	ἀσεβέω	asebéō	[ἀσεβέω] from {{g765}}; to be (by implied act) impious or wicked	g764
g765	as-eb-ace'	ἀσεβής	asebḗs	[ἀσεβής] from {{g1}} (as a negative particle) and a presumed derivative of {{g4576}}; irreverent, i.e. (by extension) impious or wicked	g765
g766	as-elg'-i-a	ἀσέλγεια	asélgeia	[ἀσέλγεια] from a compound of {{g1}} (as a negative particle) and a presumed σελγής (of uncertain derivation, but apparently meaning continent); licentiousness (sometimes including other vices)	g766
g767	as'-ay-mos	ἄσημος	ásēmos	[ἄσημος] from {{g1}} (as a negative particle) and the base of {{g4591}}; unmarked, i.e. (figuratively) ignoble	g767
g760	as-ah'	Ἀσά	Asá	[Ἀσά] of Hebrew origin ({{h609}}); Asa, an Israelite	g760
g761	as-al'-yoo-tos	ἀσάλευτος	asáleutos	[ἀσάλευτος] from {{g1}} (as a negative particle) and a derivative of {{g4531}}; unshaken, i.e. (by implication) immovable (figuratively)	g761
g762	as'-bes-tos	ἄσβεστος	ásbestos	[ἄσβεστος] from {{g1}} (as a negative particle) and a derivative of {{g4570}}; not extinguished, i.e. (by implication) perpetual	g762
g763	as-eb'-i-ah	ἀσέβεια	asébeia	[ἀσέβεια] from {{g765}}; impiety, i.e. (by implication) wickedness	g763
g768	as-ayr'	Ἀσήρ	Asḗr	[Ἀσήρ] of Hebrew origin ({{h836}}); Aser (i.e. Asher), an Israelite tribe	g768
g769	as-then'-i-ah	ἀσθένεια	asthéneia	[ἀσθένεια] from {{g772}}; feebleness (of mind or body); by implication, malady; morally, frailty	g769
g777	as'-ee-tos	ἄσιτος	ásitos	[ἄσιτος] from {{g1}} (as a negative particle) and {{g4621}}; without (taking) food	g777
g776	as-ee-tee'-ah	ἀσιτία	asitía	[ἀσιτία] from {{g777}}; fasting (the state)	g776
g775	as-ee-ar'-khace	Ἀσιάρχης	Asiárchēs	[Ἀσιάρχης] from {{g773}} and {{g746}}; an Asiarch or president of the public festivities in a city of Asia Minor	g775
g774	as-ee-an-os'	Ἀσιανός	Asianós	[Ἀσιανός] from {{g773}}; an Asian (i.e. Asiatic) or an inhabitant of Asia	g774
g773	as-ee'-ah	Ἀσία	Asía	[Ἀσία] of uncertain derivation; Asia, i.e. Asia Minor, or (usually) only its western shore	g773
g772	as-then-ace'	ἀσθενής	asthenḗs	[ἀσθενής] from {{g1}} (as a negative particle) and the base of {{g4599}}; strengthless (in various applications, literal, figurative and moral)	g772
g771	as-then'-ay-mah	ἀσθένημα	asthénēma	[ἀσθένημα] from {{g770}}; a scruple of conscience	g771
g770	as-then-eh'-o	ἀσθενέω	asthenéō	[ἀσθενέω] from {{g772}}; to be feeble (in any sense)	g770
g779	as-kos'	ἀσκός	askós	[ἀσκός] from the same as {{g778}}; a leathern (or skin) bag used as a bottle	g779
g778	as-keh'-o	ἀσκέω	askéō	[ἀσκέω] probably from the same as {{g4632}}; to elaborate, i.e. (figuratively) train (by implication, strive)	g778
g742	ar-fax-ad'	Ἀρφαξάδ	Arphaxád	[Ἀρφαξάδ] of Hebrew origin ({{h775}}); Arphaxad, a post-diluvian patriarch	g742
g743	ar-khang'-el-os	ἀρχάγγελος	archángelos	[ἀρχάγγελος] from {{g757}} and {{g32}}; a chief angel	g743
g740	ar'-tos	ἄρτος	ártos	[ἄρτος] from {{g142}}; bread (as raised) or a loaf	g740
g741	ar-too'-o	ἀρτύω	artýō	[ἀρτύω] from a presumed derivative of {{g142}}; to prepare, i.e. spice (with stimulating condiments)	g741
g746	ar-khay'	ἀρχή	archḗ	[ἀρχή] from {{g756}}; (properly abstract) a commencement, or (concretely) chief (in various applications of order, time, place, or rank)	g746
g747	ar-khay-gos'	ἀρχηγός	archēgós	[ἀρχηγός] from {{g746}} and {{g71}}; a chief leader	g747
g744	ar-khah'-yos	ἀρχαῖος	archaîos	[ἀρχαῖος] from {{g746}}; original or primeval	g744
g745	ar-khel'-ah-os	Ἀρχέλαος	Archélaos	[Ἀρχέλαος] from {{g757}} and {{g2994}}; people-ruling; Archelaus, a Jewish king	g745
g748	ar-khee-er-at-ee-kos'	ἀρχιερατικός	archieratikós	[ἀρχιερατικός] from {{g746}} and a derivative of {{g2413}}; high-priestly	g748
g749	ar-khee-er-yuce'	ἀρχιερεύς	archiereús	[ἀρχιερεύς] from {{g746}} and {{g2409}}; the high-priest (literally, of the Jews, typically, Christ); by extension a chief priest	g749
g759	ar'-o-mah	ἄρωμα	árōma	[ἄρωμα] from {{g142}} (in the sense of sending off scent); an aromatic	g759
g758	ar'-khone	ἄρχων	árchōn	[ἄρχων] present participle of {{g757}}; a first (in rank or power)	g758
g755	ar-khee-tree'-klee-nos	ἀρχιτρίκλινος	architríklinos	[ἀρχιτρίκλινος] from {{g746}} and a compound of {{g5140}} and {{g2827}} (a dinner-bed, because composed of three couches); director of the entertainment	g755
g754	ar-khee-tel-o'-nace	ἀρχιτελώνης	architelṓnēs	[ἀρχιτελώνης] from {{g746}} and {{g5057}}; a principle tax-gatherer	g754
g757	ar'-kho	ἄρχω	árchō	[ἄρχω] a primary verb; to be first (in political rank or power)	g757
g756	ar'-khom-ahee	ἄρχομαι	árchomai	[ἄρχομαι] middle voice of {{g757}} (through the implication, of precedence); to commence (in order of time)	g756
g751	ar'-khip-pos	Ἄρχιππος	Árchippos	[Ἄρχιππος] from {{g746}} and {{g2462}}; horse-ruler; Archippus, a Christian	g751
g750	ar-khee-poy'-mane	ἀρχιποίμην	archipoímēn	[ἀρχιποίμην] from {{g746}} and {{g4166}}; a head shepherd	g750
g753	ar-khee-tek'-tone	ἀρχιτέκτων	architéktōn	"[ἀρχιτέκτων] from {{g746}} and {{g5045}}; a chief constructor, i.e. ""architect"""	g753
g752	ar-khee-soon-ag'-o-gos	ἀρχισυνάγωγος	archisynágōgos	[ἀρχισυνάγωγος] from {{g746}} and {{g4864}}; director of the synagogue services	g752
g728	ar-hrab-ohn'	ἀῤῥαβών	arrhabṓn	[ἀῤῥαβών] of Hebrew origin ({{h6162}}); a pledge, i.e. part of the purchase-money or property given in advance as security for the rest	g728
g729	ar'-hhraf-os	ἄῤῥαφος	árrhaphos	[ἄῤῥαφος] from {{g1}} (as a negative particle) and a presumed derivative of the same as {{g4476}}; unsewed, i.e. of a single piece	g729
g720	ar-neh'-om-ahee	ἀρνέομαι	arnéomai	[ἀρνέομαι] perhaps from {{g1}} (as a negative particle) and the middle voice of {{g4483}}; to contradict, i.e. disavow, reject, abnegate	g720
g721	ar-nee'-on	ἀρνίον	arníon	[ἀρνίον] diminutive from {{g704}}; a lambkin	g721
g722	ar-ot-ree-o'-o	ἀροτριόω	arotrióō	[ἀροτριόω] from {{g723}}; to plow	g722
g723	ar'-ot-ron	ἄροτρον	árotron	[ἄροτρον] from ἀρόω (to till); a plow	g723
g724	har-pag-ay'	ἁρπαγή	harpagḗ	[ἁρπαγή] from {{g726}}; pillage (properly abstract)	g724
g725	har-pag-mos'	ἁρπαγμός	harpagmós	[ἁρπαγμός] from {{g726}}; plunder (properly concrete)	g725
g726	har-pad'-zo	ἁρπάζω	harpázō	[ἁρπάζω] from a derivative of {{g138}}; to seize (in various applications)	g726
g727	har'-pax	ἅρπαξ	hárpax	[ἅρπαξ] from {{g726}}; rapacious	g727
g739	ar'-tee-os	ἄρτιος	ártios	[ἄρτιος] from {{g737}}; fresh, i.e. (by implication) complete	g739
g738	ar-teeg-en'-nay-tos	ἀρτιγέννητος	artigénnētos	[ἀρτιγέννητος] from {{g737}} and {{g1084}}; just born, i.e. (figuratively) a young convert	g738
g733	ar-sen-ok-oy'-tace	ἀρσενοκοίτης	arsenokoítēs	[ἀρσενοκοίτης] from {{g730}} and {{g2845}}; a sodomite	g733
g732	ar'-hroce-tos	ἄῤῥωστος	árrhōstos	[ἄῤῥωστος] from {{g1}} (as a negative particle) and a presumed derivative of {{g4517}}; infirm	g732
g731	ar'-hray-tos	ἄῤῥητος	árrhētos	[ἄῤῥητος] from {{g1}} (as a negative particle) and the same as {{g4490}}; unsaid, i.e. (by implication) inexpressible	g731
g730	ar'-hrane	ἄῤῥην	árrhēn	[ἄῤῥην]   or ἄρσηνprobably from {{g142}}; male (as stronger for lifting)	g730
g737	ar'-tee	ἄρτι	árti	[ἄρτι] adverb from a derivative of {{g142}} (compare {{g740}}) through the idea of suspension; just now	g737
g736	ar-tem'-ohn	ἀρτέμων	artémōn	[ἀρτέμων] from a derivative of {{g737}}; properly, something ready (or else more remotely from {{g142}} (compare {{g740}}); something hung up), i.e. (specially) the topsail (rather foresail or jib) of a vessel	g736
g735	ar'-tem-is	Ἄρτεμις	Ártemis	[Ἄρτεμις] probably from the same as {{g736}}; prompt; Artemis, the name of a Grecian goddess borrowed by the Asiatics for one of their deities	g735
g734	ar-tem-as'	Ἀρτεμάς	Artemás	[Ἀρτεμάς] contracted from a compound of {{g735}} and {{g1435}}; gift of Artemis; Artemas (or Artemidorus), a Christian	g734
g788	as'-son	ἆσσον	âsson	[ἆσσον] neuter comparative of the base of {{g1451}}; more nearly, i.e. very near	g788
g789	as'-sos	Ἄσσος	Ássos	[Ἄσσος] probably of foreign origin; Assus, a city of Asia MInor	g789
g786	as'-pon-dos	ἄσπονδος	áspondos	[ἄσπονδος] from {{g1}} (as a negative particle) and a derivative of {{g4689}}; literally, without libation (which usually accompanied a treaty), i.e. (by implication) truceless	g786
g787	as-sar'-ee-on	ἀσσάριον	assárion	[ἀσσάριον] of Latin origin; an assarius or as, a Roman coin	g787
g784	as'-pee-los	ἄσπιλος	áspilos	[ἄσπιλος] from {{g1}} (as a negative particle) and {{g4695}}; unblemished (physically or morally)	g784
g785	as-pece'	ἀσπίς	aspís	"[ἀσπίς] of uncertain derivation; a buckler (or round shield); used of a serpent (as coiling itself), probably the ""asp"""	g785
g782	as-pad'-zom-ahee	ἀσπάζομαι	aspázomai	[ἀσπάζομαι] from {{g1}} (as a particle of union) and a presumed form of {{g4685}}; to enfold in the arms, i.e. (by implication) to salute, (figuratively) to welcome	g782
g783	as-pas-mos'	ἀσπασμός	aspasmós	[ἀσπασμός] from {{g782}}; a greeting (in person or by letter)	g783
g780	as-men'-oce	ἀσμένως	asménōs	[ἀσμένως] adverb from a derivative of the base of {{g2237}}; with pleasure	g780
g781	as'-of-os	ἄσοφος	ásophos	[ἄσοφος] from {{g1}} (as a negative particle) and {{g4680}}; unwise	g781
g706	ar-ith-mos'	ἀριθμός	arithmós	[ἀριθμός] from {{g142}}; a number (as reckoned up)	g706
g707	ar-ee-math-ah'-ee-ah	Ἀριμαθαία	Arimathaía	[Ἀριμαθαία] of Hebrew origin ({{h7414}}); Arimathæa (or Ramah), a place in Palestine	g707
g704	ar-ane'	ἀρήν	arḗn	[ἀρήν] perhaps the same as {{g730}}; a lamb (as a male)	g704
g705	ar-ith-meh'-o	ἀριθμέω	arithméō	[ἀριθμέω] from {{g706}}; to enumerate or count	g705
g702	ar-et'-as	Ἀρέτας	Arétas	[Ἀρέτας] of foreign origin; Aretas, an Arabian	g702
g703	ar-et'-ay	ἀρέτη	arétē	[ἀρέτη] from the same as {{g730}}; properly, manliness (valor), i.e. excellence (intrinsic or attributed)	g703
g701	ar-es-tos'	ἀρεστός	arestós	[ἀρεστός] from {{g700}}; agreeable; by implication, fit	g701
g708	ar-is'-tar-khos	Ἀρίσταρχος	Arístarchos	[Ἀρίσταρχος] from the same as {{g712}} and {{g757}}; best ruling; Aristarchus, a Macedonian	g708
g709	ar-is-tah'-o	ἀριστάω	aristáō	[ἀριστάω] from {{g712}}; to take the principle meal	g709
