Key	Pronunciation	Lexeme	Transliteration	Definition	StrongsNumber
h3057	yeh-hoo-dee-yaw'	יְהֻדִיָּה	Yᵉhudîyâh	feminine of {{h3064}}; Jehudijah, a Jewess; Jehudijah.	h3057
h3056	yeh-dah'-ee	יֶהְדַי	Yehday	perhaps from a form corresponding to {{h3061}}; Judaistic; Jehdai, an Israelite; Jehdai.	h3056
h3055	yeh-hood'	יְהֻד	Yᵉhud	a briefer form of one corresponding to {{h3061}}; Jehud, a place in Palestine; Jehud.	h3055
h3054	yaw-had'	יָהַד	yâhad	denominative from a form corresponding to {{h3061}}; to Judaize, i.e. become Jewish; become Jews.	h3054
h3053	ye-hawb'	יְהָב	yᵉhâb	from {{h3051}}; properly, what is given (by Providence), i.e. a lot; burden.	h3053
h3052	yeh-hab'	יְהַב	yᵉhab	(Aramaic) corresponding to {{h3051}}; deliver, give, lay,   prolong, pay, yield.	h3052
h3051	yaw-hab'	יָהַב	yâhab	a primitive root; to give (whether literal or figurative); generally, to put; imperatively (reflexive) come; ascribe, bring, come on, give, go, set, take.	h3051
h3050	yaw	יָהּ	Yâhh	contraction for {{h3068}}, and meaning the same; Jah, the sacred name; Jah, the Lord, most vehement. Compare names in '-iah,' '-jah.'	h3050
h3059	yeh-ho-aw-khawz'	יְהוֹאָחָז	Yᵉhôwʼâchâz	from {{h3068}} and {{h270}}; Jehovah-seized; Jehoachaz, the name of three Israelites; Jehoahaz. Compare {{h3099}}.	h3059
h3058	yay-hoo'	יֵהוּא	Yêhûwʼ	from {{h3068}} and {{h1931}}; Jehovah (is) He; Jehu, the name of five Israelites; Jehu.	h3058
h3040	yed-ee-daw'	יְדִידָה	Yᵉdîydâh	feminine of {{h3039}}; beloved; Jedidah, an Israelitess; Jedidah.	h3040
h3041	yed-ee-deh-yaw'	יְדִידְיָה	Yᵉdîydᵉyâh	from {{h3039}} and {{h3050}}; beloved of Jah; Jedidejah, a name of Solomon; Jedidiah.	h3041
h3042	yed-aw-yaw'	יְדָיָה	Yᵉdâyâh	from {{h3034}} and {{h3050}}; praised of Jah; Jedajah, the name of two Israelites; Jedaiah.	h3042
h3043	yed-ee-ah-ale'	יְדִיעֲאֵל	Yᵉdîyʻăʼêl	from {{h3045}} and {{h410}}; knowing God; Jediael, the name of three Israelites; Jediael.	h3043
h3044	yid-lawf'	יִדְלָף	Yidlâph	from {{h1811}}; tearful; Jidlaph, a Mesopotamian; Jidlaph.	h3044
h3045	yaw-dah'	יָדַע	yâdaʻ	a primitive root; to know (properly, to ascertain by seeing); used in a great variety of senses, figuratively, literally, euphemistically and inferentially (including observation, care, recognition; and causatively, instruction, designation, punishment, etc.); acknowledge, acquaintance(-ted with), advise, answer, appoint, assuredly, be aware, (un-) awares, can(-not), certainly, comprehend, consider, × could they, cunning, declare, be diligent, (can, cause to) discern, discover, endued with, familiar friend, famous, feel, can have, be (ig-) norant, instruct, kinsfolk, kinsman, (cause to let, make) know, (come to give, have, take) knowledge, have (knowledge), (be, make, make to be, make self) known,   be learned,   lie by man, mark, perceive, privy to, × prognosticator, regard, have respect, skilful, shew, can (man of) skill, be sure, of a surety, teach, (can) tell, understand, have (understanding), × will be, wist, wit, wot.	h3045
h3046	yed-ah'	יְדַע	yᵉdaʻ	(Aramaic) corresponding to {{h3045}}; certify, know, make known, teach.	h3046
h3047	yaw-daw'	יָדָע	Yâdâʻ	from {{h3045}}; knowing; Jada, an Israelite; Jada.	h3047
h3048	yed-ah-yaw'	יְדַעְיָה	Yᵉdaʻyâh	from {{h3045}} and {{h3050}}; Jah has known; Jedajah, the name of two Israelites; Jedaiah.	h3048
h3049	yid-deh-o-nee'	יִדְּעֹנִי	yiddᵉʻônîy	from {{h3045}}; properly, a knowing one; specifically, a conjurer; (by impl) a ghost; wizard.	h3049
h3035	yid-do'	יִדּוֹ	Yiddôw	from {{h3034}}; praised; Jiddo, an Israelite; Iddo.	h3035
h3034	yaw-daw'	יָדָה	yâdâh	a primitive root; used only as denominative from {{h3027}}; literally, to use (i.e. hold out) the hand; physically, to throw (a stone, an arrow) at or away; especially to revere or worship (with extended hands); intensively, to bemoan (by wringing the hands); cast (out), (make) confess(-ion), praise, shoot, (give) thank(-ful, -s, -sgiving).	h3034
h3037	yad-doo'-ah	יַדּוּעַ	Yaddûwaʻ	from {{h3045}}; knowing; Jaddua, the name of two Israelites; Jaddua.	h3037
h3036	yaw-done'	יָדוֹן	Yâdôwn	from {{h3034}}; thankful; Jadon, an Israelite; Jadon.	h3036
h3031	yid-bawsh'	יִדְבָּשׁ	Yidbâsh	from the same as {{h1706}}; perhaps honeyed; Jidbash, an Israelite; Idbash.	h3031
h3030	yid-al-aw'	יִדְאֲלָה	Yidʼălâh	of uncertain derivation; Jidalah, a place in Palestine; Idalah.	h3030
h3033	yed-ee-dooth'	יְדִדוּת	yᵉdidûwth	from {{h3039}}; properly, affection; concretely, a darling object; dearly beloved.	h3033
h3032	yaw-dad'	יָדַד	yâdad	a primitive root; (compare {{h3034}}); properly, to handle, i.e. to throw, e.g. lots; cast.	h3032
h3039	yed-eed'	יְדִיד	yᵉdîyd	from the same as {{h1730}}; loved; amiable, (well-) beloved, loves.	h3039
h3038	yed-oo-thoon'	יְדוּתוּן	Yᵉdûwthûwn	or יְדֻתוּן; or יְדִיתוּן; probably from {{h3034}}; laudatory; Jeduthun, an Israelite; Jeduthun.	h3038
h3026	yegar' sah-had-oo-thaw'	יְגַר שַׂהֲדוּתָא	Yᵉgar Sahădûwthâʼ	(Aramaic) from a word derived from an unused root (meaning to gather) and a derivation of a root corresponding to {{h7717}}; heap of the testimony; Jegar-Sahadutha, a cairn East of the Jordan; Jegar-Sahadutha.	h3026
h3027	yawd	יָד	yâd	a primitive word; a hand (the open one [indicating power, means, direction, etc.], in distinction from {{h3709}}, the closed one); used (as noun, adverb, etc.) in a great variety of applications, both literally and figuratively, both proximate and remote [as follows]; (  be) able, × about,   armholes, at, axletree, because of, beside, border, × bounty,   broad, (broken-) handed, × by, charge, coast,   consecrate,   creditor, custody, debt, dominion, × enough,   fellowship, force, × from, hand(-staves, -y work), × he, himself, × in, labour,   large, ledge, (left-) handed, means, × mine, ministry, near, × of, × order, ordinance, × our, parts, pain, power, × presumptuously, service, side, sore, state, stay, draw with strength, stroke,   swear, terror, × thee, × by them, × themselves, × thine own, × thou, through, × throwing,   thumb, times, × to, × under, × us, × wait on, (way-) side, where,   wide, × with (him, me, you), work,   yield, × yourselves.	h3027
h3024	yeg-ee-aw'	יְגִעָה	yᵉgiʻâh	feminine of {{h3019}}; fatigue; weariness.	h3024
h3025	yaw-gore'	יָגֹר	yâgôr	a primitive root; to fear; be afraid, fear.	h3025
h3022	yaw-gaw'	יָגָע	yâgâʻ	from {{h3021}}; earnings (as the product of toil); that which he laboured for.	h3022
h3023	yaw-gay'-ah	יָגֵעַ	yâgêaʻ	from {{h3021}}; tired; hence (transitive) tiresome; full of labour, weary.	h3023
h3020	yog-lee'	יׇגְלִי	Yoglîy	from {{h1540}}; exiled; Jogli, an Israelite; Jogli.	h3020
h3021	yaw-gah'	יָגַע	yâgaʻ	a primitive root; properly, to gasp; hence, to be exhausted, to tire, to toil; faint, (make to) labour, (be) weary.	h3021
h3028	yad	יַד	yad	(Aramaic) corresponding to {{h3027}}; hand, power.	h3028
h3029	yed-aw'	יְדָא	yᵉdâʼ	(Aramaic) corresponding to {{h3034}}; to praise; (give) thank(-s).	h3029
h3099	yo-aw-khawz'	יוֹאָחָז	Yôwʼâchâz	a form of {{h3059}}; Joachaz, the name of two Israelites; Jehoahaz, Joahaz.	h3099
h3098	yo-awkh'	יוֹאָח	Yôwʼâch	from {{h3068}} and {{h251}}; Jehovah-brothered; Joach, the name of four Israelites; Joah.	h3098
h3093	yaw-here'	יָהִיר	yâhîyr	probably from the same as {{h2022}}; elated; hence, arrogant; haughty, proud.	h3093
h3092	yeh-ho-shaw-fawt'	יְהוֹשָׁפָט	Yᵉhôwshâphâṭ	from {{h3068}} and {{h8199}}; Jehovah-judged; Jehoshaphat, the name of six Israelites; also of a valley near Jerusalem; Jehoshaphat. Compare {{h3146}}.	h3092
h3091	yeh-ho-shoo'-ah	יְהוֹשׁוּעַ	Yᵉhôwshûwaʻ	or יְהוֹשֻׁעַ; from {{h3068}} and {{h3467}}; Jehovah-saved; Jehoshua (i.e. Joshua), the Jewish leader; Jehoshua, Jehoshuah, Joshua. Compare {{h1954}}, {{h3442}}.	h3091
h3090	yeh-ho-shab-ath'	יְהוֹשַׁבְעַת	Yᵉhôwshabʻath	a form of {{h3089}}; Jehoshabath, an Israelitess; Jehoshabeath.	h3090
h3097	yo-awb'	יוֹאָב	Yôwʼâb	from {{h3068}} and {{h1}}; Jehovah-fathered; Joab, the name of three Israelites; Joab.	h3097
h3096	yah'-hats	יַהַץ	Yahats	or יַהְצָה; or (feminine) יַהְצָה; from an unused root meaning to stamp; perhaps threshing-floor; Jahats or Jahtsah, a place East of the Jordan; Jahaz, Jahazah, Jahzah.	h3096
h3095	yah-hal-ome'	יַהֲלֹם	yahălôm	from {{h1986}} (in the sense of hardness); a precious stone, probably onyx; diamond.	h3095
h3094	yeh-hal-lel-ale'	יְהַלֶּלְאֵל	Yᵉhallelʼêl	from {{h1984}} and {{h410}}; praising God; Jehallelel, the name of two Israelites; Jehalellel, Jehalelel.	h3094
h3013	yaw-gaw'	יָגָה	yâgâh	a primitive root; to grieve; afflict, cause grief, grieve, sorrowful, vex.	h3013
h3012	yig-dal-yaw'-hoo	יִגְדַּלְיָהוּ	Yigdalyâhûw	from {{h1431}} and {{h3050}}; magnified of Jah; Jigdaljah, an Israelite; Igdaliah.	h3012
h3011	yog-beh-haw'	יׇגְבְּהָה	Yogbᵉhâh	feminine from {{h1361}}; hillock; Jogbehah, a place East of the Jordan; Jogbehah.	h3011
h3010	yaw-gabe'	יָגֵב	yâgêb	from {{h3009}}; a plowed field; field.	h3010
h3017	yaw-goor'	יָגוּר	Yâgûwr	probably from {{h1481}}; a lodging; Jagur, a place in Palestine; Jagur.	h3017
h3016	yaw-gore'	יָגוֹר	yâgôwr	from {{h3025}}; fearful; afraid, fearest.	h3016
h3015	yaw-gohn'	יָגוֹן	yâgôwn	from {{h3013}}; affliction; grief, sorrow.	h3015
h3014	yaw-gaw'	יָגָה	yâgâh	a primitive root (probably rather the same as {{h3013}} through the common idea of dissatisfaction); to push away; be removed.	h3014
h3019	yaw-ghee'-ah	יָגִיעַ	yâgîyaʻ	from {{h3021}}; tired; weary.	h3019
h3018	yeg-ee'-ah	יְגִיעַ	yᵉgîyaʻ	from {{h3021}}; toil; hence, a work, produce, property (as the result of labor); labour, work.	h3018
h3084	yeh-ho-safe'	יְהוֹסֵף	Yᵉhôwçêph	a fuller form of {{h3130}}; Jehoseph (i.e. Joseph), a son of Jacob; Joseph.	h3084
h3085	yeh-ho-ad-daw'	יְהוֹעַדָּה	Yᵉhôwʻaddâh	from {{h3068}} and {{h5710}}; Jehovah-adorned; Jehoaddah, an Israelite; Jehoada.	h3085
h3086	yeh-ho-ad-deen'	יְהוֹעַדִּין	Yᵉhôwʻaddîyn	or יְהוֹעַדָּן; from {{h3068}} and {{h5727}}; Jehovahpleased; Jehoaddin or Jehoaddan, an Israelitess; Jehoaddan.	h3086
h3087	yeh-ho-tsaw-dawk'	יְהוֹצָדָק	Yᵉhôwtsâdâq	from {{h3068}} and {{h6663}}; Jehovah-righted; Jehotsadak, an Israelite; Jehozadek, Josedech. Compare {{h3136}}.	h3087
h3080	yeh-ho-yaw-reeb'	יְהוֹיָרִיב	Yᵉhôwyârîyb	from {{h3068}} and {{h7378}}; Jehovah will contend; Jehojarib, the name of two Israelites; Jehoiarib. Compare {{h3114}}.	h3080
h3081	yeh-hoo-kal'	יְהוּכַל	Yᵉhûwkal	from {{h3201}}; potent; Jehukal, an Israelite; Jehucal. Compare {{h3116}}.	h3081
h3082	yeh-ho-naw-dawb'	יְהוֹנָדָב	Yᵉhôwnâdâb	from {{h3068}} and {{h5068}}; Jehovah-largessed; Jehonadab, the name of an Israelite and of an Arab; Jehonadab, Jonadab. Compare {{h3122}}.	h3082
h3083	yeh-ho-naw-thawn'	יְהוֹנָתָן	Yᵉhôwnâthân	from {{h3068}} and {{h5414}}; Jehovah-given; Jehonathan, the name of four Israelites; Jonathan. Compare {{h3129}}.	h3083
h3088	yeh-ho-rawm'	יְהוֹרָם	Yᵉhôwrâm	from {{h3068}} and {{h7311}}; Jehovah-raised; Jehoram, the name of a Syrian and of three Israelites; Jehoram, Joram. Compare {{h3141}}.	h3088
h3089	yeh-ho-sheh'-bah	יְהוֹשֶׁבַע	Yᵉhôwshebaʻ	from {{h3068}} and {{h7650}}; Jehovah-sworn; Jehosheba, an Israelitess; Jehosheba. Compare {{h3090}}.	h3089
h3008	yig-awl'	יִגְאָל	Yigʼâl	from {{h1350}}; avenger; Jigal, the name of three Israelites; Igal, Igeal.	h3008
h3009	yaw-gab'	יָגַב	yâgab	a primitive root; to dig or plow; husbandman.	h3009
h3004	yab-baw-shaw'	יַבָּשָׁה	yabbâshâh	from {{h3001}}; dry ground; dry (ground, land).	h3004
h3005	yib-sawm'	יִבְשָׂם	Yibsâm	from the same as {{h1314}}; fragrant; Jibsam, an Israelite; Jibsam.	h3005
h3006	yab-beh'-sheth	יַבֶּשֶׁת	yabbesheth	a variation of {{h3004}}; dry ground; dry land.	h3006
h3007	yab-beh'-sheth	יַבֶּשֶׁת	yabbesheth	(Aramaic) corresponding to {{h3006}}; dry land; earth.	h3007
h3001	yaw-bashe'	יָבֵשׁ	yâbêsh	a primitive root; to be ashamed, confused or disappointed; also (as failing) to dry up (as water) or wither (as herbage); be ashamed, clean, be confounded, (make) dry (up), (do) shame(-fully), × utterly, wither (away).	h3001
h3002	yaw-bashe'	יָבֵשׁ	yâbêsh	from {{h3001}}; dry; dried (away), dry.	h3002
h3003	yaw-bashe'	יָבֵשׁ	Yâbêsh	the same as {{h3002}} (also יָבֵישׁ; often with the addition of {{h1568}}, i.e. Jabesh of Gilad); Jobesh, the name of an Israelite and of a place in Palestine; Jobesh (-Gilead).	h3003
h3079	yeh-ho-yaw-keem'	יְהוֹיָקִים	Yᵉhôwyâqîym	from {{h3068}} abbreviated and {{h6965}}; Jehovah will raise; Jehojakim, a Jewish king; Jehoiakim. Compare {{h3113}}.	h3079
h3078	yeh-ho-yaw-keen'	יְהוֹיָכִין	Yᵉhôwyâkîyn	from {{h3068}} and {{h3559}}; Jehovah will establish; Jehojakin, a Jewish king; Jehoiachin. Compare {{h3112}}.	h3078
h3071	yeh-ho-vaw' nis-see'	יְהֹוָה נִסִּי	Yᵉhôvâh niççîy	from {{h3068}} and {{h5251}} with the prononimal suffix; Jehovah (is) my banner; Jehovah-Nissi, a symbolical name of an altar in the Desert; Jehovah-nissi.	h3071
h3070	yeh-ho-vaw' yir-eh'	יְהֹוָה יִרְאֶה	Yᵉhôvâh yirʼeh	from {{h3068}} and {{h7200}}; Jehovah will see (to it); Jehovah-Jireh, a symbolical name for Mount Moriah; Jehovah-jireh.	h3070
h3073	yeh-ho-vaw' shaw-lome'	יְהֹוָה שָׁלוֹם	Yᵉhôvâh shâlôwm	from {{h3068}} and {{h7965}}; Jehovah (is) peace; Jehovah-Shalom, a symbolical name of an altar in Palestine; Jehovah-shalom.	h3073
h3072	ye-ho-vaw' tsid-kay'-noo	יְהֹוָה צִדְקֵנוּ	Yᵉhôvâh tsidqênûw	from {{h3068}} and {{h6664}} with pronominal suffix; Jehovah (is) our right; Jehovah-Tsidkenu, a symbolical epithet of the Messiah and of Jerusalem; the Lord our righteousness.	h3072
h3075	yeh-ho-zaw-bawd'	יְהוֹזָבָד	Yᵉhôwzâbâd	from {{h3068}} and {{h2064}}; Jehovah-endowed; Jehozabad, the name of three Israelites; Jehozabad. Compare {{h3107}}.	h3075
h3074	yeh-ho-vaw' shawm'-maw	יְהֹוָה שָׁמָּה	Yᵉhôvâh shâmmâh	from {{h3068}} and {{h8033}} with directive enclitic; Jehovah (is) thither; Jehovah-Shammah, a symbolic title of Jerusalem; Jehovahshammah.	h3074
h3077	yeh-ho-yaw-daw'	יְהוֹיָדָע	Yᵉhôwyâdâʻ	from {{h3068}} and {{h3045}}; Jehovah-known; Jehojada, the name of three Israelites; Jehoiada. Compare {{h3111}}.	h3077
h3076	yeh-ho-khaw-nawn'	יְהוֹחָנָן	Yᵉhôwchânân	from {{h3068}} and {{h2603}}; Jehovah-favored; Jehochanan, the name of eight Israelites; Jehohanan, Johanan. Compare {{h3110}}.	h3076
h3068	yeh-ho-vaw'	יְהֹוָה	Yᵉhôvâh	from {{h1961}}; (the) self-Existent or Eternal; Jeho-vah, Jewish national name of God; Jehovah, the Lord. Compare {{h3050}}, {{h3069}}.	h3068
h3069	yeh-ho-vee'	יְהֹוִה	Yᵉhôvih	a variation of {{h3068}} [used after {{h136}}, and pronounced by Jews as {{h430}}, in order to prevent the repetition of the same sound, since they elsewhere pronounce {{h3068}} as {{h136}}]; God.	h3069
h3100	yo-ale'	יוֹאֵל	Yôwʼêl	from {{h3068}} and {{h410}}; Jehovah (is his) God; Joel, the name of twelve Israelites; Joel.	h3100
h3062	yeh-hoo-daw-ee'	יְהוּדָאִי	Yᵉhûwdâʼîy	(Aramaic) patrial from {{h3061}}; a Jehudaite (or Judaite), i.e. Jew; Jew.	h3062
h3063	yeh-hoo-daw'	יְהוּדָה	Yᵉhûwdâh	from {{h3034}}; celebrated; Jehudah (or Judah), the name of five Israelites; also of the tribe descended from the first, and of its territory; Judah.	h3063
h3060	yeh-ho-awsh'	יְהוֹאָשׁ	Yᵉhôwʼâsh	from {{h3068}} and (perhaps) {{h784}}; Jehovah-fired; Jehoash, the name of two Israelite kings; Jehoash. Compare {{h3101}}.	h3060
h3061	yeh-hood'	יְהוּד	Yᵉhûwd	(Aramaic) contracted from a form corresponding to {{h3063}}; properly, Judah, hence, Judaea; Jewry, Judah, Judea.	h3061
h3066	yeh-hoo-deeth'	יְהוּדִית	Yᵉhûwdîyth	feminine of {{h3064}}; the Jewish (used adverbially) language; in the Jews' language.	h3066
h3067	yeh-ho-deeth'	יְהוּדִית	Yᵉhûwdîyth	the same as {{h3066}}; Jewess; Jehudith, a Canaanitess; Judith.	h3067
h3064	yeh-hoo-dee'	יְהוּדִי	Yᵉhûwdîy	patronymically from {{h3063}}; a Jehudite (i.e. Judaite or Jew), or descendant of Jehudah (i.e. Judah); Jew.	h3064
h3065	yeh-hoo-dee'	יְהוּדִי	Yᵉhûwdîy	the same as {{h3064}}; Jehudi, an Israelite; Jehudi.	h3065
