Key	Pronunciation	Lexeme	Transliteration	Definition	StrongsNumber
g3489	now-ag-eh'-o	ναυαγέω	nauagéō	"[ναυαγέω] from a compound of {{g3491}} and {{g71}}; to be shipwrecked (stranded, ""navigate""), literally or figuratively"	g3489
g3488	nar'-kis-sos	Νάρκισσος	Nárkissos	"[Νάρκισσος] a flower of the same name, from νάρκη (stupefaction, as a ""narcotic""); Narcissus, a Roman"	g3488
g3483	nahee	ναί	naí	[ναί] a primary particle of strong affirmation; yes	g3483
g3482	nath-an-ah-ale'	Ναθαναήλ	Nathanaḗl	[Ναθαναήλ] of Hebrew origin ({{h5417}}); Nathanaël (i.e. Nathanel), an Israelite and Christian	g3482
g3481	nath-an'	Ναθάν	Nathán	[Ναθάν] of Hebrew origin ({{h5416}}); Nathan, an Israelite	g3481
g3480	nad-zo-rah'-yos	Ναζωραῖος	Nazōraîos	[Ναζωραῖος] from {{g3478}}; a Nazoræan, i.e. inhabitant of Nazareth; by extension, a Christian	g3480
g3487	nar'dos	νάρδος	nárdos	"[νάρδος] of foreign origin (compare {{h5373}}); ""nard"""	g3487
g3486	nah-oom'	Ναούμ	Naoúm	[Ναούμ] of Hebrew origin ({{h5151}}); Naum (i.e. Nachum), an Israelite	g3486
g3485	nah-os'	ναός	naós	[ναός] from a primary ναίω (to dwell); a fane, shrine, temple  Compare {{g2411}}.	g3485
g3484	nah-in'	Ναΐν	Naḯn	[Ναΐν] probably of Hebrew origin (compare {{h4999}}); Nain, a place in Palestine	g3484
g3403	mim-nace'-ko	μιμνήσκω	mimnḗskō	[μιμνήσκω] a prolonged form of {{g3415}} (from which some of the tenses are borrowed); to remind, i.e. (middle voice) to recall to mind	g3403
g3402	mim-ay-tace'	μιμητής	mimētḗs	[μιμητής] from {{g3401}}; an imitator	g3402
g3401	mim-eh'-om-ahee	μιμέομαι	miméomai	"[μιμέομαι] middle voice from μῖμος (a ""mimic""); to imitate"	g3401
g3407	mis'-thee-os	μίσθιος	místhios	[μίσθιος] from {{g3408}}; a wage-earner	g3407
g3406	mis-thap-od-ot'-ace	μισθαποδότης	misthapodótēs	[μισθαποδότης] from {{g3409}} and {{g591}}; a renumerator	g3406
g3405	mis-thap-od-os-ee'-ah	μισθαποδοσία	misthapodosía	[μισθαποδοσία] from {{g3406}}; requital (good or bad)	g3405
g3404	mis-eh'-o	μισέω	miséō	[μισέω] from a primary μῖσος (hatred); to detest (especially to persecute); by extension, to love less	g3404
g3409	mis-tho'-o	μισθόω	misthóō	[μισθόω] from {{g3408}}; to let out for wages, i.e. (middle voice) to hire	g3409
g3408	mis-thos'	μισθός	misthós	[μισθός] apparently a primary word; pay for service (literally or figuratively), good or bad	g3408
g3494	neh-an-ee'-as	νεανίας	neanías	[νεανίας] from a derivative of {{g3501}}; a youth (up to about forty years)	g3494
g3495	neh-an-is'-kos	νεανίσκος	neanískos	[νεανίσκος] from the same as {{g3494}}; a youth (under forty)	g3495
g3496	neh-ap'-ol-is	Νεάπολις	Neápolis	[Νεάπολις] from {{g3501}} and {{g4172}}; new town; Neapolis, a place in Macedonia	g3496
g3497	neh-eh-man'	Νεεμάν	Neemán	[Νεεμάν] of Hebrew origin ({{h5283}}); Neeman (i.e. Naaman), a Syrian	g3497
g3490	now'-klay-ros	ναύκληρος	naúklēros	"[ναύκληρος] from {{g3491}} and {{g2819}} (""clerk""); a captain"	g3490
g3491	nowce	ναῦς	naûs	[ναῦς] from νάω or νέω (to float); a boat (of any size)	g3491
g3492	now'-tace	ναύτης	naútēs	[ναύτης] from {{g3491}}; a boatman, i.e. seaman	g3492
g3493	nakh-ore'	Ναχώρ	Nachṓr	[Ναχώρ] of Hebrew origin ({{h5152}}); Nachor, the grandfather of Abraham	g3493
g3498	nek-ros'	νεκρός	nekrós	[νεκρός] from an apparently primary νέκυς (a corpse); dead (literally or figuratively; also as noun)	g3498
g3499	nek-ro'-o	νεκρόω	nekróō	[νεκρόω] from {{g3498}}; to deaden, i.e. (figuratively) to subdue	g3499
g3418	mnay'-mah	μνῆμα	mnēma	[μνῆμα] from {{g3415}}; a memorial, i.e. sepulchral monument (burial-place)	g3418
g3419	mnay-mi'-on	μνημεῖον	mnēmeîon	[μνημεῖον] from {{g3420}}; a remembrance, i.e. cenotaph (place of interment)	g3419
g3414	mnah	μνᾶ	mnâ	[μνᾶ] of Latin origin; a mna (i.e. mina), a certain weight	g3414
g3415	mnah'-om-ahee	μνάομαι	mnáomai	[μνάομαι] middle voice of a derivative of {{g3306}} or perhaps of the base of {{g3145}} (through the idea of fixture in the mind or of mental grasp); to bear in mind, i.e. recollect; by implication, to reward or punish Compare {{g3403}}.	g3415
g3416	mnah'-sohn	Μνάσων	Mnásōn	[Μνάσων] of uncertain origin; Mnason, a Christian	g3416
g3417	mni'-ah	μνεία	mneía	[μνεία] from {{g3415}} or {{g3403}}; recollection; by implication, recital	g3417
g3410	mis'-tho-mah	μίσθωμα	místhōma	[μίσθωμα] from {{g3409}}; a rented building	g3410
g3411	mis-tho-tos'	μισθωτός	misthōtós	[μισθωτός] from {{g3409}}; a wage-worker (good or bad)	g3411
g3412	mit-oo-lay'-nay	Μιτυλήνη	Mitylḗnē	[Μιτυλήνη] for μυτιλήνη (abounding in shellfish); Mitylene (or Mytilene), a town on the island of Lesbos	g3412
g3413	mikh-ah-ale'	Μιχαήλ	Michaḗl	[Μιχαήλ] of Hebrew origin ({{h4317}}); Michael, an archangel	g3413
g3469	mo-mah'-om-ahee	μωμάομαι	mōmáomai	[μωμάομαι] from {{g3470}}; to carp at, i.e. censure (discredit)	g3469
g3468	mo'-lopes	μώλωψ	mṓlōps	"[μώλωψ] from μῶλος (""moil""; probably akin to the base of {{g3433}}) and probably ὤψ (the face; from {{g3700}}); a mole (""black eye"") or blow-mark"	g3468
g3461	moo-ree'-as	μυριάς	myriás	"[μυριάς] from {{g3463}}; a ten-thousand; by extension, a ""myriad"" or indefinite number"	g3461
g3460	moo'-rah	Μύρα	Mýra	[Μύρα] of uncertain derivation; Myra, a place in Asia Minor	g3460
g3463	moo'-ree-oi	μύριοι	mýrioi	[μύριοι] plural of an apparently primary word (properly, meaning very many); ten thousand; by extension, innumerably many	g3463
g3462	moo-rid'-zo	μυρίζω	myrízō	[μυρίζω] from {{g3464}}; to apply (perfumed) unguent to	g3462
g3465	moo-see'-ah	Μυσία	Mysía	[Μυσία] of uncertain origin; Mysia, a region of Asia Minor	g3465
g3464	moo'-ron	μύρον	mýron	"[μύρον] probably of foreign origin (compare {{h4753}}, {{g4666}}); ""myrrh"", i.e. (by implication) perfumed oil"	g3464
g3467	moo-ope-ad'-zo	μυωπάζω	myōpázō	[μυωπάζω] from a compound of the base of {{g3466}} and ὤψ (the face; from {{g3700}}); to shut the eyes, i.e. blink (see indistinctly)	g3467
g3466	moos-tay'-ree-on	μυστήριον	mystḗrion	"[μυστήριον] from a derivative of μύω (to shut the mouth); a secret or ""mystery"" (through the idea of silence imposed by initiation into religious rites)"	g3466
g3478	nad-zar-eth'	Ναζαρέθ	Nazaréth	[Ναζαρέθ]   or Ναζαρέτ;  of uncertain derivation; Nazareth or Nazaret, a place in Palestine	g3478
g3479	nad-zar-ay-nos'	Ναζαρηνός	Nazarēnós	[Ναζαρηνός] from {{g3478}}; a Nazarene, i.e. inhabitant of Nazareth	g3479
g3472	mo-ree'-ah	μωρία	mōría	[μωρία] from {{g3474}}; silliness, i.e. absurdity	g3472
g3473	mo-rol-og-ee'-ah	μωρολογία	mōrología	[μωρολογία] from a compound of {{g3474}} and {{g3004}}; silly talk, i.e. buffoonery	g3473
g3470	mo'-mos	μῶμος	mōmos	[μῶμος] perhaps from {{g3201}}; a flaw or blot, i.e. (figuratively) disgraceful person	g3470
g3471	mo-rah'-ee-no	μωραίνω	mōraínō	[μωραίνω] from {{g3474}}; to become insipid; figuratively, to make (passively, act) as a simpleton	g3471
g3476	nah-as-sone'	Ναασσών	Naassṓn	[Ναασσών] of Hebrew origin ({{h5177}}); Naasson (i.e. Nachshon), an Israelite	g3476
g3477	nang-gah'-ee	Ναγγαί	Nangaí	[Ναγγαί] probably of Hebrew origin (compare {{h5052}}); Nangæ (i.e. perhaps Nogach), an Israelite	g3477
g3474	mo-ros'	μωρός	mōrós	[μωρός] probably from the base of {{g3466}}; dull or stupid (as if shut up), i.e. heedless, (morally) blockhead, (apparently) absurd	g3474
g3475	moce-yoos'	Μωσεύς	Mōseús	[Μωσεύς]   or Μωσῆς,  or Μωϋσῆςof Hebrew  origin; ({{h4872}}); Moseus, Moses, or Mouses (i.e. Mosheh), the Hebrew lawgiver	g3475
g3447	mos-khop-oy-eh'-o	μοσχοποιέω	moschopoiéō	[μοσχοποιέω] from {{g3448}} and {{g4160}}; to fabricate the image of a bullock	g3447
g3446	mor'-fo-sis	μόρφωσις	mórphōsis	[μόρφωσις] from {{g3445}}; formation, i.e. (by implication), appearance (semblance or (concretely) formula)	g3446
g3445	mor-fo'-o	μορφόω	morphóō	[μορφόω] from the same as {{g3444}}; to fashion (figuratively)	g3445
g3444	mor-fay'	μορφή	morphḗ	[μορφή] perhaps from the base of {{g3313}} (through the idea of adjustment of parts); shape; figuratively, nature	g3444
g3443	mon-o'-o	μονόω	monóō	[μονόω] from {{g3441}}; to isolate, i.e. bereave	g3443
g3442	mon-of'-thal-mos	μονόφθαλμος	monóphthalmos	[μονόφθαλμος] from {{g3441}} and {{g3788}}; one-eyed	g3442
g3441	mon'-os	μόνος	mónos	[μόνος] probably from {{g3306}}; remaining, i.e. sole or single; by implication, mere	g3441
g3440	mon'-on	μόνον	mónon	[μόνον] neuter of {{g3441}} as adverb; merely	g3440
g3449	mokh'-thos	μόχθος	móchthos	[μόχθος] from the base of {{g3425}}; toil, i.e. (by implication) sadness	g3449
g3448	mos'-khos	μόσχος	móschos	[μόσχος] probably strengthened for όσχος (a shoot); a young bullock	g3448
g3450	moo	μοῦ	moû	[μοῦ] the simpler form of {{g1700}}; of me	g3450
g3451	moo-sik-os'	μουσικός	mousikós	"[μουσικός] from Μοῦσα (a Muse); ""musical"", i.e. (as noun) a minstrel"	g3451
g3452	moo-el-os'	μυελός	myelós	[μυελός] perhaps a primary word; the marrow	g3452
g3453	moo-eh'-o	μυέω	myéō	[μυέω] from the base of {{g3466}}; to initiate, i.e. (by implication) to teach	g3453
g3454	moo'-thos	μῦθος	mŷthos	"[μῦθος] perhaps from the same as {{g3453}} (through the idea of tuition); a tale, i.e. fiction (""myth"")"	g3454
g3455	moo-kah'-om-ahee	μυκάομαι	mykáomai	"[μυκάομαι] from a presumed derivative of μύζω ( to ""moo""); to bellow (roar)"	g3455
g3456	mook-tay-rid'-zo	μυκτηρίζω	myktērízō	[μυκτηρίζω] from a derivative of the base of {{g3455}} (meaning snout, as that whence lowing proceeds); to make mouths at, i.e. ridicule	g3456
g3457	moo-lee-kos'	μυλικός	mylikós	[μυλικός] from {{g3458}}; belonging to a mill	g3457
g3458	moo'-los	μύλος	mýlos	"[μύλος] probably ultimately from the base of {{g3433}} (through the idea of hardship); a ""mill"", i.e. (by implication), a grinder (millstone)"	g3458
g3459	moo'-lone	μύλων	mýlōn	[μύλων] from {{g3458}}; a mill-house	g3459
g3425	mog'-is	μόγις	mógis	[μόγις] adverb from a primary μόγος (toil); with difficulty	g3425
g3424	mog-il-al'-os	μογιλάλος	mogilálos	[μογιλάλος] from {{g3425}} and {{g2980}}; hardly talking, i.e. dumb (tongue-tied)	g3424
g3427	moy	μοί	moí	[μοί] the simpler form of {{g1698}}; to me	g3427
g3426	mod'-ee-os	μόδιος	módios	[μόδιος] of Latin origin; a modius, i.e. certain measure for things dry (the quantity or the utensil)	g3426
g3421	mnay-mon-yoo'-o	μνημονεύω	mnēmoneúō	[μνημονεύω] from a derivative of {{g3420}}; to exercise memory, i.e. recollect; by implication, to punish; also to rehearse	g3421
g3420	mnay'-may	μνήμη	mnḗmē	[μνήμη] from {{g3403}}; memory	g3420
g3423	mnace-tyoo'-o	μνηστεύω	mnēsteúō	[μνηστεύω] from a derivative of {{g3415}}; to give a souvenir (engagement present), i.e. betroth	g3423
g3422	mnay-mos'-oo-non	μνημόσυνον	mnēmósynon	[μνημόσυνον] from {{g3421}}; a reminder (memorandum), i.e. record	g3422
g3500	nek'-ro-sis	νέκρωσις	nékrōsis	[νέκρωσις] from {{g3499}}; decease; figuratively, impotency	g3500
g3429	moy-khah'-o	μοιχάω	moicháō	[μοιχάω] from {{g3432}}; (middle voice) to commit adultery	g3429
g3428	moy-khal-is'	μοιχαλίς	moichalís	[μοιχαλίς] a prolonged form of the feminine of {{g3432}}; an adulteress (literally or figuratively)	g3428
g3436	mol-oos-mos'	μολυσμός	molysmós	[μολυσμός] from {{g3435}}; a stain; i.e. (figuratively) immorality	g3436
g3437	mom-fay'	μομφή	momphḗ	[μομφή] from {{g3201}}; blame, i.e. (by implication), a fault	g3437
g3434	mol-okh'	Μολόχ	Molóch	[Μολόχ] of Hebrew origin ({{h4432}}); Moloch (i.e. Molek), an idol	g3434
g3435	mol-oo'-no	μολύνω	molýnō	[μολύνω] probably from {{g3189}}; to soil (figuratively)	g3435
g3432	moy-khos'	μοιχός	moichós	[μοιχός] perhaps a primary word; a (male) paramour; figuratively, apostate	g3432
g3433	mol'-is	μόλις	mólis	[μόλις] probably by variation for {{g3425}}; with difficulty	g3433
g3430	moy-khi'-ah	μοιχεία	moicheía	[μοιχεία] from {{g3431}}; adultery	g3430
g3431	moy-khyoo'-o	μοιχεύω	moicheúō	[μοιχεύω] from {{g3432}}; to commit adultery	g3431
g3438	mon-ay'	μονή	monḗ	[μονή] from {{g3306}}; a staying, i.e. residence (the act or the place)	g3438
g3439	mon-og-en-ace'	μονογενής	monogenḗs	[μονογενής] from {{g3441}} and {{g1096}}; only-born, i.e. sole	g3439
