Key	Pronunciation	Lexeme	Transliteration	Definition	StrongsNumber
h4568	mah-ab-eh'	מַעֲבֶה	maʻăbeh	from {{h5666}}; properly, compact (part of soil), i.e. loam; clay.	h4568
h4569	mah-ab-awr'	מַעֲבָר	maʻăbâr	or feminine מַעֲבָרָה; from {{h5674}}; a crossing-place (of a river, a ford; of a mountain, a pass); abstractly, a transit, i.e. (figuratively) overwhelming; ford, place where...pass, passage.	h4569
h4562	maw-so'-reth	מָסֹרֶת	mâçôreth	from {{h631}}; a band; bond.	h4562
h4563	mis-tore'	מִסְתּוֹר	miçtôwr	from {{h5641}}; a refuge; covert.	h4563
h4560	maw-sar'	מָסַר	mâçar	a primitive root; to sunder, i.e. (transitively) set apart, or (reflex.) apostatize; commit, deliver.	h4560
h4561	mo-sawr'	מֹסָר	môçâr	from {{h3256}}; admonition; instruction.	h4561
h4566	mah-bawd'	מַעְבָּד	maʻbâd	from {{h5647}}; an act; work.	h4566
h4567	mah-bawd'	מַעְבָד	maʻbâd	(Aramaic) corresponding to {{h4566}}; an act; work.	h4567
h4564	mas-tare'	מַסְתֵּר	maçtêr	from {{h5641}}; properly, a hider, i.e. (abstractly) a hiding, i.e. aversion; hid.	h4564
h4565	mis-tawr'	מִסְתָּר	miçtâr	from {{h5641}}; properly, a concealer, i.e. a covert; secret(-ly, place).	h4565
h4557	mis-pawr'	מִסְפָּר	miçpâr	from {{h5608}}; a number, definite (arithmetical) or indefinite (large, innumerable; small, a few); also (abstractly) narration; abundance, account, × all, × few, (in-) finite, (certain) number(-ed), tale, telling,   time.	h4557
h4556	mis-pakh'-ath	מִסְפַּחַת	miçpachath	from {{h5596}}; scruf (as spreading over the surface); scab.	h4556
h4555	mis-paw-khaw'	מִסְפָּחָה	miçpâchâh	from {{h5596}}; a veil (as spread out); kerchief.	h4555
h4554	mis-po'	מִסְפּוֹא	miçpôwʼ	from an unused root meaning to collect; fodder; provender.	h4554
h4553	mis-pade'	מִסְפֵּד	miçpêd	from {{h5594}}; a lamentation; lamentation, one mourneth, mourning, wailing.	h4553
h4552	mis-awd'	מִסְעָד	miçʻâd	' from {{h5582}}; a balustrade (for stairs); pillar.	h4552
h4551	mas-saw'	מַסָּע	maççâʻ	from {{h5265}} in the sense of projecting; a missile (spear or arrow); also a quarry (whence stones are, as it were, ejected); before it was brought, dart.	h4551
h4550	mas-sah'	מַסַּע	maççaʻ	from {{h5265}}; a departure (from striking the tents), i.e. march (not necessarily a single day's travel); by implication, a station (or point of departure); journey(-ing).	h4550
h4559	mis-peh'-reth	מִסְפֶּרֶת	Miçpereth	feminine of {{h4437}}; enumeration; Mispereth, an Israelite; Mispereth. Compare {{h4458}}.	h4559
h4558	mis-pawr'	מִסְפָּר	Miçpâr	the same as {{h4457}}; number; Mispar, an Israelite; Mizpar. Compare {{h4559}}.	h4558
h4540	mes-ook-kaw'	מְסֻכָּה	mᵉçukkâh	from {{h5526}}; a covering, i.e. garniture; covering.	h4540
h4541	mas-say-kaw'	מַסֵּכָה	maççêkâh	from {{h5258}}; properly, a pouring over, i.e. fusion of metal (especially a cast image); by implication, a libation, i.e. league; concretely a coverlet (as if poured out); covering, molten (image), vail.	h4541
h4542	mis-kane'	מִסְכֵּן	miçkên	from {{h5531}}; indigent; poor (man).	h4542
h4543	mis-ken-aw'	מִסְכְּנָה	miçkᵉnâh	by transp. from {{h3664}}; a magazine; store(-house), treasure.	h4543
h4544	mis-kay-nooth'	מִסְכֵּנֻת	miçkênuth	from {{h4542}}; indigence; scarceness.	h4544
h4545	mas-seh'-keth	מַסֶּכֶת	maççeketh	from {{h5259}} in the sense of spreading out; something expanded, i.e. the warp in a loom (as stretched out to receive the woof); web.	h4545
h4546	mes-il-law'	מְסִלָּה	mᵉçillâh	from {{h5549}}; a thoroughfare (as turnpiked), literally or figuratively; specifically a viaduct, a staircase; causeway, course, highway, path, terrace.	h4546
h4547	mas-lool'	מַסְלוּל	maçlûwl	from {{h5549}}; a thoroughfare (as turnpiked); highway.	h4547
h4548	mas-mare'	מַסְמֵר	maçmêr	or מִסְמֵר; also (feminine) מַסְמְרָה; or מִסְמְרָה; or even מַשְׂמְרָה; (Ecclesiastes 12:11), from {{h5568}}; a peg (as bristling from the surface); nail.	h4548
h4549	maw-sas'	מָסַס	mâçaç	a primitive root; to liquefy; figuratively, to waste (with disease), to faint (with fatigue, fear or grief); discourage, faint, be loosed, melt (away), refuse, × utterly.	h4549
h4535	mas-sawkh'	מַסָּח	maççâch	from {{h5255}} in the sense of staving off; a cordon, (adverbially) or (as a) military barrier; broken down.	h4535
h4534	mes-oo-kaw'	מְסוּכָה	mᵉçûwkâh	for {{h4881}}; a hedge; thorn hedge.	h4534
h4537	maw-sak'	מָסַךְ	mâçak	a primitive root; to mix, especially wine (with spices); mingle.	h4537
h4536	mis-khawr'	מִסְחָר	miçchâr	from {{h5503}}; trade; traffic.	h4536
h4531	mas-saw'	מַסָּה	maççâh	from {{h5254}}; a testing, of men (judicial) or of God (querulous); temptation, trial.	h4531
h4530	mis-saw'	מִסָּה	miççâh	from {{h4549}} (in the sense of flowing); abundance, i.e. (adverbially) liberally; tribute.	h4530
h4533	mas-veh'	מַסְוֶה	maçveh	apparently from an unused root meaning to cover; a veil; vail.	h4533
h4532	mas-saw'	מַסָּה	Maççâh	the same as {{h4531}}; Massah, a place in the Desert; Massah.	h4532
h4539	maw-sawk'	מָסָךְ	mâçâk	from {{h5526}}; a cover, i.e. veil; covering, curtain, hanging.	h4539
h4538	meh'-sek	מֶסֶךְ	meçek	from {{h4537}}; a mixture, i.e. of wine with spices; mixture.	h4538
h4600	maw-ak'	מָעַךְ	mâʻak	a primitive root; to press, i.e. to pierce, emasculate, handle; bruised, stuck, be pressed.	h4600
h4526	mis-gheh'-reth	מִסְגֶּרֶת	miçgereth	from {{h5462}}; something enclosing, i.e. a margin (of a region, of a panel); concretely, a stronghold; border, close place, hole.	h4526
h4527	mas-sad'	מַסַּד	maççad	from {{h3245}}; a foundation; foundation.	h4527
h4524	may-sab'	מֵסַב	mêçab	plural masculine מְסִבִּים; or feminine מְסִבּוֹת; from {{h5437}}; a divan (as enclosing the room); abstractly (adverbial) around; that compass about, (place) round about, at table.	h4524
h4525	mas-gare'	מַסְגֵּר	maçgêr	from {{h5462}}; a fastener, i.e. (of a person) a smith, (of a thing) a prison; prison, smith.	h4525
h4522	mas	מַס	maç	or מִס; from {{h4549}}; properly, a burden (as causing to faint), i.e. a tax in the form of forced labor; discomfited, levy, task(-master), tribute(-tary).	h4522
h4523	mawce	מָס	mâç	from {{h4549}}; fainting, i.e. (figuratively) disconsolate; is afflicted.	h4523
h4520	men-ash-shee'	מְנַשִּׁי	Mᵉnashshîy	from {{h4519}}; a Menashshite or descendant of Menashsheh; of Manasseh, Manassites.	h4520
h4521	men-awth'	מְנָת	mᵉnâth	from {{h4487}}; an allotment (by courtesy, law or providence); portion.	h4521
h4528	mis-der-ohn'	מִסְדְּרוֹן	miçdᵉrôwn	from the same as {{h5468}}; a colonnade or internal portico (from its rows of pillars); porch.	h4528
h4529	maw-saw'	מָסָה	mâçâh	a primitive root; to dissolve; make to consume away, (make to) melt, water.	h4529
h4599	mah-yawn'	מַעְיָן	maʻyân	or מַעְיְנוֹ; (Psalm 114:8), or (feminine) מַעְיָנָה; from {{h5869}} (as a denominative in the sense of a spring); a fountain (also collectively), figuratively, a source (of satisfaction); fountain, spring, well.	h4599
h4598	meh-eel'	מְעִיל	mᵉʻîyl	from {{h4603}} in the sense of covering; a robe (i.e. upper and outer garment); cloke, coat, mantle, robe.	h4598
h4593	maw-ote'	מָעֹט	mâʻôṭ	passive adjective of {{h4591}}; thinned (as to the edge), i.e. sharp; wrapped up.	h4593
h4592	meh-at'	מְעַט	mᵉʻaṭ	or מְעָט; from {{h4591}}; a little or few (often adverbial or comparative); almost (some, very) few(-er, -est), lightly, little (while), (very) small (matter, thing), some, soon, × very.	h4592
h4591	maw-at'	מָעַט	mâʻaṭ	a primitive root; properly, to pare off, i.e. lessen; intransitively, to be (or causatively, to make) small or few (or figuratively, ineffective); suffer to decrease, diminish, (be, × borrow a, give, make) few (in number, -ness), gather least (little), be (seem) little, (× give the) less, be minished, bring to nothing.	h4591
h4590	mah-az-yaw'	מַעַזְיָה	Maʻazyâh	or מַעַזְיָהוּ; probably from {{h5756}} (in the sense of protection) and {{h3050}}; rescue of Jah; Maazjah, the name of two Israelites; Maaziah.	h4590
h4597	maw-ah'-ee	מָעַי	Mâʻay	probably from {{h4578}}; sympathetic; Maai, an Israelite; Maai.	h4597
h4596	meh-ee'	מְעִי	mᵉʻîy	from {{h5753}}; (compare {{h5856}}); a pile of rubbish (as contorted), i.e. a ruin; heap.	h4596
h4595	mah-at-aw-faw'	מַעֲטָפָה	maʻăṭâphâh	from {{h5848}}; a cloak; mantle.	h4595
h4594	mah-at-eh'	מַעֲטֶה	maʻăṭeh	from {{h5844}}; a vestment; garment.	h4594
h4513	maw-nah'	מָנַע	mânaʻ	a primitive root; to debar (negatively or positively) from benefit or injury; deny, keep (back), refrain, restrain, withhold.	h4513
h4512	min-leh'	מִנְלֶה	minleh	from {{h5239}}; completion, i.e. (in produce) wealth; perfection.	h4512
h4511	min-neeth'	מִנִּית	Minnîyth	from the same as {{h4482}}; enumeration; Minnith, a place East of the Jordan; Minnith.	h4511
h4510	min-yawn'	מִנְיָן	minyân	(Aramaic) from {{h4483}}; enumeration; number.	h4510
h4517	men-ah-ah'	מְנַעְנַע	mᵉnaʻnaʻ	from {{h5128}}; a sistrum (so called from its rattling sound); cornet.	h4517
h4516	man-am'	מַנְעַם	manʻam	from {{h5276}}; a delicacy; dainty.	h4516
h4515	man-awl'	מִנְעָל	minʻâl	from {{h5274}}; a bolt; shoe.	h4515
h4514	man-ool'	מַנְעוּל	manʻûwl	or מַנְעֻל; from {{h5274}}; a bolt; lock.	h4514
h4519	men-ash-sheh'	מְנַשֶּׁה	Mᵉnashsheh	from {{h5382}}; causing to forget; Menashsheh, a grandson of Jacob, also the tribe descended from him, and its territory; Manasseh.	h4519
h4518	men-ak-keeth'	מְנַקִּית	mᵉnaqqîyth	from {{h5352}}; a sacrificial basin (for holding blood); bowl.	h4518
h4584	maw-ohn'	מָעוֹן	Mâʻôwn	the same as {{h4583}}; a residence; Maon, the name of an Israelite and of a place in Palestine; Maon, Maonites. Compare {{h1010}}, {{h4586}}.	h4584
h4585	meh-o-naw'	מְעוֹנָה	mᵉʻôwnâh	or מְעֹנָה; feminine of {{h4583}}, and meaning the same; den, habitation, (dwelling) place, refuge.	h4585
h4586	meh-oo-nee'	מְעוּנִי	Mᵉʻûwnîy	or מְעִינִי; probably patrial from {{h4584}}; a Meunite, or inhabitant of Maon (only in plural); Mehunim(-s), Meunim.	h4586
h4587	meh-o-no-thah'-ee	מְעוֹנֹתַי	Mᵉʻôwnôthay	plural of {{h4585}}; habitative; Meonothai, an Israelite; Meonothai.	h4587
h4580	maw-ogue'	מָעוֹג	mâʻôwg	from {{h5746}}; also with {{h3934}} a table-buffoon, i.e.; a cake of bread; parasite; cake, feast.	h4580
h4581	maw-oze'	מָעוֹז	mâʻôwz	(also מָעוּז ); or מָעֹז (also מָעֻז; from {{h5810}}; a fortified place; figuratively, a defence; force, fort(-ress), rock, strength(-en), (× most) strong (hold).	h4581
h4582	maw-oke'	מָעוֹךְ	Mâʻôwk	from {{h4600}}; oppressed; Maok, a Philistine; Maoch.	h4582
h4583	maw-ohn'	מָעוֹן	mâʻôwn	or מָעִין; (1 Chronicles 4:41), from the same as {{h5772}}; an abode, of God (the Tabernacle or the Temple), men (their home) or animals (their lair); hence, a retreat (asylum); den, dwelling((-) place), habitation.	h4583
h4588	maw-off'	מָעוּף	mâʻûwph	from {{h5774}} in the sense of covering with shade (compare {{h4155}}); darkness; dimness.	h4588
h4589	maw-ore'	מָעוֹר	mâʻôwr	from {{h5783}}; nakedness, i.e. (in plural) the pudenda; nakedness.	h4589
h4508	min-nee'	מִנִּי	Minnîy	of foreign derivation; Minni, an Armenian province; Minni.	h4508
h4509	min-yaw-meen'	מִנְיָמִין	Minyâmîyn	from {{h4480}} and {{h3225}}; from (the) right hand; Minjamin, the name of two Israelites; Miniamin. Compare {{h4326}}.	h4509
h4504	min-khaw'	מִנְחָה	minchâh	(Aramaic) corresponding to {{h4503}}; a sacrificial offering; oblation, meat offering.	h4504
h4505	men-akh-ame'	מְנַחֵם	Mᵉnachêm	from {{h5162}}; comforter; Menachem, an Israelite; Menahem.	h4505
h4506	maw-nakh'-ath	מָנַחַת	Mânachath	from {{h5117}}; rest; Manachath, the name of an Edomite and of a place in Moab; Manahath.	h4506
h4507	men-ee'	מְנִי	Mᵉnîy	from {{h4487}}; the Apportioner, i.e. Fate (as an idol); number.	h4507
h4501	men-o-raw'	מְנוֹרָה	mᵉnôwrâh	or מְנֹרָה; feminine of {{h4500}} (in the original sense of {{h5216}}); a chandelier; candlestick.	h4501
h4502	min-ez-awr'	מִנְּזָר	minnᵉzâr	from {{h5144}}; a prince; crowned.	h4502
h4503	min-khaw'	מִנְחָה	minchâh	from an unused root meaning to apportion, i.e. bestow; a donation; euphemistically, tribute; specifically a sacrificial offering (usually bloodless and voluntary); gift, oblation, (meat) offering, present, sacrifice.	h4503
h4579	may-aw'	מֵעָה	mêʻâh	feminine of {{h4578}}; the belly, i.e. (figuratively) interior; gravel.	h4579
h4578	may-aw'	מֵעֶה	mêʻeh	from an unused root probably meaning to be soft; used only in plural the intestines, or (collectively) the abdomen, figuratively, sympathy; by implication, a vest; by extension the stomach, the uterus (or of men, the seat of generation), the heart (figuratively); belly, bowels, × heart, womb.	h4578
h4571	maw-ad'	מָעַד	mâʻad	a primitive root; to waver; make to shake, slide, slip.	h4571
h4570	mah-gawl'	מַעְגָּל	maʻgâl	or feminine מַעְגָּלָה; from the same as {{h5696}}; a track (literally or figuratively); also a rampart (as circular); going, path, trench, way(-side).	h4570
h4573	mah-ad-yaw'	מַעֲדְיָה	Maʻădyâh	from {{h5710}} and {{h3050}}; ornament of Jah; Maadjah, an Israelite; Maadiah. Compare {{h4153}}.	h4573
h4572	mah-ad-ah'-ee	מַעֲדַי	Maʻăday	from {{h5710}}; ornamental; Maadai, an Israelite; Maadai.	h4572
h4575	mah-ad-an-naw'	מַעֲדַנָּה	maʻădannâh	by transitive from {{h6029}}; a bond, i.e. group; influence.	h4575
h4574	mah-ad-awn'	מַעֲדָן	maʻădân	or (feminine) מַעֲדַנָּה; from {{h5727}}; a delicacy or (abstractly) pleasure (adverbially, cheerfully); dainty, delicately, delight.	h4574
h4577	meh-aw'	מְעָה	mᵉʻâh	(Aramaic) or מְעָא; (Aramaic), corresponding to {{h4578}}; only in plural the bowels; belly.	h4577
h4576	mah-dare'	מַעְדֵּר	maʻdêr	from {{h5737}}; a (weeding) hoe; mattock.	h4576
